======================================================================
SYNTHETIC DATASET GENERATION
======================================================================
Output directory: ml/data/synthetic_bank_priority2
Archetypes: A, B, C, D, E
Scenarios: 5 archetypes × 100 scenarios = 500 total
Period: 2023-2025 (Train: 2023-2024, Test: 2025)
Structure: Organized by archetype (A/, B/, C/, D/, E/)

Generating scenarios:   0%|          | 0/500 [00:00<?, ?it/s]Generating scenarios:   0%|          | 1/500 [00:00<01:05,  7.62it/s]Generating scenarios:   0%|          | 2/500 [00:00<01:02,  8.03it/s]Generating scenarios:   1%|          | 3/500 [00:00<01:00,  8.21it/s]Generating scenarios:   1%|          | 4/500 [00:00<01:00,  8.26it/s]Generating scenarios:   1%|          | 5/500 [00:00<01:00,  8.25it/s]Generating scenarios:   1%|          | 6/500 [00:00<00:59,  8.28it/s]Generating scenarios:   1%|▏         | 7/500 [00:00<00:59,  8.30it/s]Generating scenarios:   2%|▏         | 8/500 [00:00<00:59,  8.22it/s]Generating scenarios:   2%|▏         | 9/500 [00:01<01:01,  8.02it/s]Generating scenarios:   2%|▏         | 10/500 [00:01<01:00,  8.13it/s]Generating scenarios:   2%|▏         | 11/500 [00:01<00:59,  8.19it/s]Generating scenarios:   2%|▏         | 12/500 [00:01<00:59,  8.20it/s]Generating scenarios:   3%|▎         | 13/500 [00:01<00:59,  8.23it/s]Generating scenarios:   3%|▎         | 14/500 [00:01<00:59,  8.21it/s]Generating scenarios:   3%|▎         | 15/500 [00:01<00:59,  8.19it/s]Generating scenarios:   3%|▎         | 16/500 [00:01<00:59,  8.16it/s]Generating scenarios:   3%|▎         | 17/500 [00:02<00:58,  8.21it/s]Generating scenarios:   4%|▎         | 18/500 [00:02<00:58,  8.23it/s]Generating scenarios:   4%|▍         | 19/500 [00:02<00:58,  8.27it/s]Generating scenarios:   4%|▍         | 20/500 [00:02<00:58,  8.25it/s]Generating scenarios:   4%|▍         | 21/500 [00:02<00:57,  8.26it/s]Generating scenarios:   4%|▍         | 22/500 [00:02<00:57,  8.28it/s]Generating scenarios:   5%|▍         | 23/500 [00:02<00:57,  8.28it/s]Generating scenarios:   5%|▍         | 24/500 [00:02<00:57,  8.26it/s]Generating scenarios:   5%|▌         | 25/500 [00:03<00:57,  8.32it/s]Generating scenarios:   5%|▌         | 26/500 [00:03<00:56,  8.32it/s]Generating scenarios:   5%|▌         | 27/500 [00:03<00:56,  8.36it/s]Generating scenarios:   6%|▌         | 28/500 [00:03<00:56,  8.32it/s]Generating scenarios:   6%|▌         | 29/500 [00:03<00:56,  8.27it/s]Generating scenarios:   6%|▌         | 30/500 [00:03<00:56,  8.29it/s]Generating scenarios:   6%|▌         | 31/500 [00:03<00:57,  8.17it/s]Generating scenarios:   6%|▋         | 32/500 [00:03<00:56,  8.23it/s]Generating scenarios:   7%|▋         | 33/500 [00:04<00:56,  8.20it/s]Generating scenarios:   7%|▋         | 34/500 [00:04<00:57,  8.14it/s]Generating scenarios:   7%|▋         | 35/500 [00:04<00:56,  8.20it/s]Generating scenarios:   7%|▋         | 36/500 [00:04<00:56,  8.23it/s]Generating scenarios:   7%|▋         | 37/500 [00:04<00:56,  8.24it/s]Generating scenarios:   8%|▊         | 38/500 [00:04<00:56,  8.19it/s]Generating scenarios:   8%|▊         | 39/500 [00:04<00:57,  8.07it/s]Generating scenarios:   8%|▊         | 40/500 [00:04<00:56,  8.11it/s]Generating scenarios:   8%|▊         | 41/500 [00:04<00:56,  8.18it/s]Generating scenarios:   8%|▊         | 42/500 [00:05<00:55,  8.25it/s]Generating scenarios:   9%|▊         | 43/500 [00:05<00:55,  8.27it/s]Generating scenarios:   9%|▉         | 44/500 [00:05<00:55,  8.17it/s]Generating scenarios:   9%|▉         | 45/500 [00:05<00:55,  8.16it/s]Generating scenarios:   9%|▉         | 46/500 [00:05<00:55,  8.15it/s]Generating scenarios:   9%|▉         | 47/500 [00:05<00:55,  8.14it/s]Generating scenarios:  10%|▉         | 48/500 [00:05<00:55,  8.20it/s]Generating scenarios:  10%|▉         | 49/500 [00:05<00:55,  8.07it/s]Generating scenarios:  10%|█         | 50/500 [00:06<00:55,  8.05it/s]Generating scenarios:  10%|█         | 51/500 [00:06<00:55,  8.14it/s]Generating scenarios:  10%|█         | 52/500 [00:06<00:54,  8.20it/s]Generating scenarios:  11%|█         | 53/500 [00:06<00:56,  7.98it/s]Generating scenarios:  11%|█         | 54/500 [00:06<00:55,  7.98it/s]Generating scenarios:  11%|█         | 55/500 [00:06<00:55,  8.04it/s]Generating scenarios:  11%|█         | 56/500 [00:06<00:55,  8.06it/s]Generating scenarios:  11%|█▏        | 57/500 [00:06<00:54,  8.13it/s]Generating scenarios:  12%|█▏        | 58/500 [00:07<00:54,  8.12it/s]Generating scenarios:  12%|█▏        | 59/500 [00:07<01:06,  6.67it/s]Generating scenarios:  12%|█▏        | 60/500 [00:07<01:02,  7.06it/s]Generating scenarios:  12%|█▏        | 61/500 [00:07<00:59,  7.40it/s]Generating scenarios:  12%|█▏        | 62/500 [00:07<00:57,  7.63it/s]Generating scenarios:  13%|█▎        | 63/500 [00:07<00:56,  7.74it/s]Generating scenarios:  13%|█▎        | 64/500 [00:07<00:55,  7.84it/s]Generating scenarios:  13%|█▎        | 65/500 [00:08<00:54,  7.99it/s]Generating scenarios:  13%|█▎        | 66/500 [00:08<00:54,  7.97it/s]Generating scenarios:  13%|█▎        | 67/500 [00:08<00:54,  7.97it/s]Generating scenarios:  14%|█▎        | 68/500 [00:08<00:53,  8.07it/s]Generating scenarios:  14%|█▍        | 69/500 [00:08<00:53,  8.03it/s]Generating scenarios:  14%|█▍        | 70/500 [00:08<00:53,  8.10it/s]Generating scenarios:  14%|█▍        | 71/500 [00:08<00:52,  8.12it/s]Generating scenarios:  14%|█▍        | 72/500 [00:08<00:52,  8.09it/s]Generating scenarios:  15%|█▍        | 73/500 [00:09<00:52,  8.12it/s]Generating scenarios:  15%|█▍        | 74/500 [00:09<00:52,  8.13it/s]Generating scenarios:  15%|█▌        | 75/500 [00:09<00:52,  8.07it/s]Generating scenarios:  15%|█▌        | 76/500 [00:09<00:52,  8.07it/s]Generating scenarios:  15%|█▌        | 77/500 [00:09<00:52,  8.05it/s]Generating scenarios:  16%|█▌        | 78/500 [00:09<00:51,  8.13it/s]Generating scenarios:  16%|█▌        | 79/500 [00:09<00:51,  8.16it/s]Generating scenarios:  16%|█▌        | 80/500 [00:09<00:51,  8.20it/s]Generating scenarios:  16%|█▌        | 81/500 [00:09<00:50,  8.22it/s]Generating scenarios:  16%|█▋        | 82/500 [00:10<00:50,  8.24it/s]Generating scenarios:  17%|█▋        | 83/500 [00:10<00:50,  8.20it/s]Generating scenarios:  17%|█▋        | 84/500 [00:10<00:50,  8.25it/s]Generating scenarios:  17%|█▋        | 85/500 [00:10<00:50,  8.21it/s]Generating scenarios:  17%|█▋        | 86/500 [00:10<00:50,  8.13it/s]Generating scenarios:  17%|█▋        | 87/500 [00:10<00:50,  8.16it/s]Generating scenarios:  18%|█▊        | 88/500 [00:10<00:50,  8.20it/s]Generating scenarios:  18%|█▊        | 89/500 [00:10<00:50,  8.09it/s]Generating scenarios:  18%|█▊        | 90/500 [00:11<00:50,  8.10it/s]Generating scenarios:  18%|█▊        | 91/500 [00:11<00:50,  8.16it/s]Generating scenarios:  18%|█▊        | 92/500 [00:11<00:49,  8.18it/s]Generating scenarios:  19%|█▊        | 93/500 [00:11<00:49,  8.14it/s]Generating scenarios:  19%|█▉        | 94/500 [00:11<00:50,  8.10it/s]Generating scenarios:  19%|█▉        | 95/500 [00:11<00:50,  8.07it/s]Generating scenarios:  19%|█▉        | 96/500 [00:11<00:49,  8.08it/s]Generating scenarios:  19%|█▉        | 97/500 [00:11<00:49,  8.14it/s]Generating scenarios:  20%|█▉        | 98/500 [00:12<00:49,  8.17it/s]Generating scenarios:  20%|█▉        | 99/500 [00:12<00:49,  8.10it/s]Generating scenarios:  20%|██        | 100/500 [00:12<00:49,  8.14it/s]Generating scenarios:  20%|██        | 101/500 [00:12<00:48,  8.18it/s]Generating scenarios:  20%|██        | 102/500 [00:12<00:48,  8.22it/s]Generating scenarios:  21%|██        | 103/500 [00:12<00:48,  8.20it/s]Generating scenarios:  21%|██        | 104/500 [00:12<00:47,  8.28it/s]Generating scenarios:  21%|██        | 105/500 [00:12<00:47,  8.30it/s]Generating scenarios:  21%|██        | 106/500 [00:13<00:47,  8.30it/s]Generating scenarios:  21%|██▏       | 107/500 [00:13<00:46,  8.36it/s]Generating scenarios:  22%|██▏       | 108/500 [00:13<00:46,  8.38it/s]Generating scenarios:  22%|██▏       | 109/500 [00:13<00:46,  8.35it/s]Generating scenarios:  22%|██▏       | 110/500 [00:13<00:46,  8.32it/s]Generating scenarios:  22%|██▏       | 111/500 [00:13<00:46,  8.34it/s]Generating scenarios:  22%|██▏       | 112/500 [00:13<00:46,  8.30it/s]Generating scenarios:  23%|██▎       | 113/500 [00:13<00:46,  8.34it/s]Generating scenarios:  23%|██▎       | 114/500 [00:14<00:46,  8.35it/s]Generating scenarios:  23%|██▎       | 115/500 [00:14<00:45,  8.39it/s]Generating scenarios:  23%|██▎       | 116/500 [00:14<00:46,  8.33it/s]Generating scenarios:  23%|██▎       | 117/500 [00:14<00:46,  8.30it/s]Generating scenarios:  24%|██▎       | 118/500 [00:14<00:45,  8.31it/s]Generating scenarios:  24%|██▍       | 119/500 [00:14<00:45,  8.35it/s]Generating scenarios:  24%|██▍       | 120/500 [00:14<00:45,  8.31it/s]Generating scenarios:  24%|██▍       | 121/500 [00:14<00:46,  8.24it/s]Generating scenarios:  24%|██▍       | 122/500 [00:14<00:45,  8.26it/s]Generating scenarios:  25%|██▍       | 123/500 [00:15<00:45,  8.29it/s]Generating scenarios:  25%|██▍       | 124/500 [00:15<00:45,  8.24it/s]Generating scenarios:  25%|██▌       | 125/500 [00:15<00:45,  8.24it/s]Generating scenarios:  25%|██▌       | 126/500 [00:15<00:45,  8.21it/s]Generating scenarios:  25%|██▌       | 127/500 [00:15<00:45,  8.17it/s]Generating scenarios:  26%|██▌       | 128/500 [00:15<00:45,  8.18it/s]Generating scenarios:  26%|██▌       | 129/500 [00:15<00:45,  8.22it/s]Generating scenarios:  26%|██▌       | 130/500 [00:15<00:45,  8.19it/s]Generating scenarios:  26%|██▌       | 131/500 [00:16<00:45,  8.20it/s]Generating scenarios:  26%|██▋       | 132/500 [00:16<00:44,  8.22it/s]Generating scenarios:  27%|██▋       | 133/500 [00:16<00:45,  8.14it/s]Generating scenarios:  27%|██▋       | 134/500 [00:16<00:44,  8.14it/s]Generating scenarios:  27%|██▋       | 135/500 [00:16<00:44,  8.16it/s]Generating scenarios:  27%|██▋       | 136/500 [00:16<00:44,  8.17it/s]Generating scenarios:  27%|██▋       | 137/500 [00:16<00:44,  8.22it/s]Generating scenarios:  28%|██▊       | 138/500 [00:16<00:43,  8.24it/s]Generating scenarios:  28%|██▊       | 139/500 [00:17<00:44,  8.20it/s]Generating scenarios:  28%|██▊       | 140/500 [00:17<00:44,  8.16it/s]Generating scenarios:  28%|██▊       | 141/500 [00:17<00:43,  8.17it/s]Generating scenarios:  28%|██▊       | 142/500 [00:17<00:43,  8.18it/s]Generating scenarios:  29%|██▊       | 143/500 [00:17<00:43,  8.19it/s]Generating scenarios:  29%|██▉       | 144/500 [00:17<00:43,  8.17it/s]Generating scenarios:  29%|██▉       | 145/500 [00:17<00:43,  8.19it/s]Generating scenarios:  29%|██▉       | 146/500 [00:17<00:43,  8.19it/s]Generating scenarios:  29%|██▉       | 147/500 [00:18<00:43,  8.18it/s]Generating scenarios:  30%|██▉       | 148/500 [00:18<00:42,  8.23it/s]Generating scenarios:  30%|██▉       | 149/500 [00:18<00:42,  8.18it/s]Generating scenarios:  30%|███       | 150/500 [00:18<00:43,  8.09it/s]Generating scenarios:  30%|███       | 151/500 [00:18<00:42,  8.14it/s]Generating scenarios:  30%|███       | 152/500 [00:18<00:42,  8.13it/s]Generating scenarios:  31%|███       | 153/500 [00:18<00:42,  8.14it/s]Generating scenarios:  31%|███       | 154/500 [00:18<00:42,  8.11it/s]Generating scenarios:  31%|███       | 155/500 [00:19<00:42,  8.14it/s]Generating scenarios:  31%|███       | 156/500 [00:19<00:42,  8.15it/s]Generating scenarios:  31%|███▏      | 157/500 [00:19<00:42,  8.15it/s]Generating scenarios:  32%|███▏      | 158/500 [00:19<00:42,  8.11it/s]Generating scenarios:  32%|███▏      | 159/500 [00:19<00:41,  8.15it/s]Generating scenarios:  32%|███▏      | 160/500 [00:19<00:41,  8.15it/s]Generating scenarios:  32%|███▏      | 161/500 [00:19<00:43,  7.88it/s]Generating scenarios:  32%|███▏      | 162/500 [00:19<00:49,  6.80it/s]Generating scenarios:  33%|███▎      | 163/500 [00:20<00:48,  7.02it/s]Generating scenarios:  33%|███▎      | 164/500 [00:20<00:45,  7.38it/s]Generating scenarios:  33%|███▎      | 165/500 [00:20<00:43,  7.64it/s]Generating scenarios:  33%|███▎      | 166/500 [00:20<00:42,  7.84it/s]Generating scenarios:  33%|███▎      | 167/500 [00:20<00:41,  8.03it/s]Generating scenarios:  34%|███▎      | 168/500 [00:20<00:40,  8.10it/s]Generating scenarios:  34%|███▍      | 169/500 [00:20<00:40,  8.21it/s]Generating scenarios:  34%|███▍      | 170/500 [00:20<00:39,  8.29it/s]Generating scenarios:  34%|███▍      | 171/500 [00:21<00:39,  8.23it/s]Generating scenarios:  34%|███▍      | 172/500 [00:21<00:39,  8.32it/s]Generating scenarios:  35%|███▍      | 173/500 [00:21<00:38,  8.39it/s]Generating scenarios:  35%|███▍      | 174/500 [00:21<00:39,  8.33it/s]Generating scenarios:  35%|███▌      | 175/500 [00:21<00:39,  8.31it/s]Generating scenarios:  35%|███▌      | 176/500 [00:21<00:38,  8.33it/s]Generating scenarios:  35%|███▌      | 177/500 [00:21<00:38,  8.38it/s]Generating scenarios:  36%|███▌      | 178/500 [00:21<00:38,  8.37it/s]Generating scenarios:  36%|███▌      | 179/500 [00:22<00:38,  8.36it/s]Generating scenarios:  36%|███▌      | 180/500 [00:22<00:38,  8.35it/s]Generating scenarios:  36%|███▌      | 181/500 [00:22<00:38,  8.35it/s]Generating scenarios:  36%|███▋      | 182/500 [00:22<00:38,  8.26it/s]Generating scenarios:  37%|███▋      | 183/500 [00:22<00:38,  8.22it/s]Generating scenarios:  37%|███▋      | 184/500 [00:22<00:38,  8.21it/s]Generating scenarios:  37%|███▋      | 185/500 [00:22<00:38,  8.25it/s]Generating scenarios:  37%|███▋      | 186/500 [00:22<00:38,  8.22it/s]Generating scenarios:  37%|███▋      | 187/500 [00:22<00:37,  8.28it/s]Generating scenarios:  38%|███▊      | 188/500 [00:23<00:37,  8.24it/s]Generating scenarios:  38%|███▊      | 189/500 [00:23<00:37,  8.25it/s]Generating scenarios:  38%|███▊      | 190/500 [00:23<00:37,  8.18it/s]Generating scenarios:  38%|███▊      | 191/500 [00:23<00:37,  8.20it/s]Generating scenarios:  38%|███▊      | 192/500 [00:23<00:37,  8.25it/s]Generating scenarios:  39%|███▊      | 193/500 [00:23<00:37,  8.24it/s]Generating scenarios:  39%|███▉      | 194/500 [00:23<00:37,  8.24it/s]Generating scenarios:  39%|███▉      | 195/500 [00:23<00:37,  8.24it/s]Generating scenarios:  39%|███▉      | 196/500 [00:24<00:36,  8.27it/s]Generating scenarios:  39%|███▉      | 197/500 [00:24<00:36,  8.27it/s]Generating scenarios:  40%|███▉      | 198/500 [00:24<00:36,  8.26it/s]Generating scenarios:  40%|███▉      | 199/500 [00:24<00:36,  8.28it/s]Generating scenarios:  40%|████      | 200/500 [00:24<00:36,  8.17it/s]Generating scenarios:  40%|████      | 201/500 [00:24<00:37,  7.98it/s]Generating scenarios:  40%|████      | 202/500 [00:24<00:36,  8.05it/s]Generating scenarios:  41%|████      | 203/500 [00:24<00:37,  8.00it/s]Generating scenarios:  41%|████      | 204/500 [00:25<00:36,  8.05it/s]Generating scenarios:  41%|████      | 205/500 [00:25<00:36,  8.12it/s]Generating scenarios:  41%|████      | 206/500 [00:25<00:35,  8.19it/s]Generating scenarios:  41%|████▏     | 207/500 [00:25<00:36,  8.13it/s]Generating scenarios:  42%|████▏     | 208/500 [00:25<00:35,  8.19it/s]Generating scenarios:  42%|████▏     | 209/500 [00:25<00:35,  8.15it/s]Generating scenarios:  42%|████▏     | 210/500 [00:25<00:35,  8.15it/s]Generating scenarios:  42%|████▏     | 211/500 [00:25<00:35,  8.13it/s]Generating scenarios:  42%|████▏     | 212/500 [00:26<00:36,  7.98it/s]Generating scenarios:  43%|████▎     | 213/500 [00:26<00:36,  7.91it/s]Generating scenarios:  43%|████▎     | 214/500 [00:26<00:35,  8.02it/s]Generating scenarios:  43%|████▎     | 215/500 [00:26<00:35,  8.10it/s]Generating scenarios:  43%|████▎     | 216/500 [00:26<00:53,  5.31it/s]Generating scenarios:  43%|████▎     | 217/500 [00:26<00:49,  5.76it/s]Generating scenarios:  44%|████▎     | 218/500 [00:27<00:44,  6.32it/s]Generating scenarios:  44%|████▍     | 219/500 [00:27<00:41,  6.77it/s]Generating scenarios:  44%|████▍     | 220/500 [00:27<00:38,  7.18it/s]Generating scenarios:  44%|████▍     | 221/500 [00:27<00:37,  7.48it/s]Generating scenarios:  44%|████▍     | 222/500 [00:27<00:36,  7.69it/s]Generating scenarios:  45%|████▍     | 223/500 [00:27<00:35,  7.87it/s]Generating scenarios:  45%|████▍     | 224/500 [00:27<00:34,  8.02it/s]Generating scenarios:  45%|████▌     | 225/500 [00:27<00:34,  8.09it/s]Generating scenarios:  45%|████▌     | 226/500 [00:28<00:40,  6.76it/s]Generating scenarios:  45%|████▌     | 227/500 [00:28<00:38,  7.08it/s]Generating scenarios:  46%|████▌     | 228/500 [00:28<00:36,  7.43it/s]Generating scenarios:  46%|████▌     | 229/500 [00:28<00:35,  7.67it/s]Generating scenarios:  46%|████▌     | 230/500 [00:28<00:34,  7.83it/s]Generating scenarios:  46%|████▌     | 231/500 [00:28<00:33,  7.93it/s]Generating scenarios:  46%|████▋     | 232/500 [00:28<00:40,  6.67it/s]Generating scenarios:  47%|████▋     | 233/500 [00:29<00:37,  7.12it/s]Generating scenarios:  47%|████▋     | 234/500 [00:29<00:36,  7.37it/s]Generating scenarios:  47%|████▋     | 235/500 [00:29<00:34,  7.58it/s]Generating scenarios:  47%|████▋     | 236/500 [00:29<00:33,  7.77it/s]Generating scenarios:  47%|████▋     | 237/500 [00:29<00:33,  7.85it/s]Generating scenarios:  48%|████▊     | 238/500 [00:29<00:32,  7.98it/s]Generating scenarios:  48%|████▊     | 239/500 [00:29<00:32,  8.01it/s]Generating scenarios:  48%|████▊     | 240/500 [00:29<00:32,  8.05it/s]Generating scenarios:  48%|████▊     | 241/500 [00:29<00:32,  8.04it/s]Generating scenarios:  48%|████▊     | 242/500 [00:30<00:32,  8.04it/s]Generating scenarios:  49%|████▊     | 243/500 [00:30<00:31,  8.06it/s]Generating scenarios:  49%|████▉     | 244/500 [00:30<00:31,  8.06it/s]Generating scenarios:  49%|████▉     | 245/500 [00:30<00:31,  8.01it/s]Generating scenarios:  49%|████▉     | 246/500 [00:30<00:31,  8.06it/s]Generating scenarios:  49%|████▉     | 247/500 [00:30<00:31,  8.12it/s]Generating scenarios:  50%|████▉     | 248/500 [00:30<00:31,  8.08it/s]Generating scenarios:  50%|████▉     | 249/500 [00:30<00:31,  8.08it/s]Generating scenarios:  50%|█████     | 250/500 [00:31<00:30,  8.12it/s]Generating scenarios:  50%|█████     | 251/500 [00:31<00:30,  8.17it/s]Generating scenarios:  50%|█████     | 252/500 [00:31<00:30,  8.22it/s]Generating scenarios:  51%|█████     | 253/500 [00:31<00:29,  8.25it/s]Generating scenarios:  51%|█████     | 254/500 [00:31<00:30,  8.17it/s]Generating scenarios:  51%|█████     | 255/500 [00:31<00:30,  8.05it/s]Generating scenarios:  51%|█████     | 256/500 [00:31<00:30,  8.09it/s]Generating scenarios:  51%|█████▏    | 257/500 [00:31<00:29,  8.17it/s]Generating scenarios:  52%|█████▏    | 258/500 [00:32<00:29,  8.19it/s]Generating scenarios:  52%|█████▏    | 259/500 [00:32<00:29,  8.25it/s]Generating scenarios:  52%|█████▏    | 260/500 [00:32<00:39,  6.13it/s]Generating scenarios:  52%|█████▏    | 261/500 [00:32<00:36,  6.47it/s]Generating scenarios:  52%|█████▏    | 262/500 [00:32<00:35,  6.75it/s]Generating scenarios:  53%|█████▎    | 263/500 [00:32<00:33,  7.16it/s]Generating scenarios:  53%|█████▎    | 264/500 [00:32<00:32,  7.20it/s]Generating scenarios:  53%|█████▎    | 265/500 [00:33<00:31,  7.51it/s]Generating scenarios:  53%|█████▎    | 266/500 [00:33<00:30,  7.79it/s]Generating scenarios:  53%|█████▎    | 267/500 [00:33<00:29,  7.91it/s]Generating scenarios:  54%|█████▎    | 268/500 [00:33<00:28,  8.10it/s]Generating scenarios:  54%|█████▍    | 269/500 [00:33<00:28,  8.21it/s]Generating scenarios:  54%|█████▍    | 270/500 [00:33<00:27,  8.27it/s]Generating scenarios:  54%|█████▍    | 271/500 [00:33<00:27,  8.36it/s]Generating scenarios:  54%|█████▍    | 272/500 [00:33<00:27,  8.43it/s]Generating scenarios:  55%|█████▍    | 273/500 [00:34<00:30,  7.47it/s]Generating scenarios:  55%|█████▍    | 274/500 [00:34<00:30,  7.51it/s]Generating scenarios:  55%|█████▌    | 275/500 [00:34<00:35,  6.26it/s]Generating scenarios:  55%|█████▌    | 276/500 [00:34<00:44,  5.02it/s]Generating scenarios:  55%|█████▌    | 277/500 [00:34<00:41,  5.32it/s]Generating scenarios:  56%|█████▌    | 278/500 [00:35<00:40,  5.54it/s]Generating scenarios:  56%|█████▌    | 279/500 [00:35<00:36,  5.99it/s]Generating scenarios:  56%|█████▌    | 280/500 [00:35<00:34,  6.33it/s]Generating scenarios:  56%|█████▌    | 281/500 [00:35<00:35,  6.18it/s]Generating scenarios:  56%|█████▋    | 282/500 [00:35<00:34,  6.40it/s]Generating scenarios:  57%|█████▋    | 283/500 [00:35<00:35,  6.20it/s]Generating scenarios:  57%|█████▋    | 284/500 [00:35<00:33,  6.53it/s]Generating scenarios:  57%|█████▋    | 285/500 [00:36<00:31,  6.91it/s]Generating scenarios:  57%|█████▋    | 286/500 [00:36<00:29,  7.21it/s]Generating scenarios:  57%|█████▋    | 287/500 [00:36<00:28,  7.44it/s]Generating scenarios:  58%|█████▊    | 288/500 [00:36<00:27,  7.75it/s]Generating scenarios:  58%|█████▊    | 289/500 [00:36<00:28,  7.36it/s]Generating scenarios:  58%|█████▊    | 290/500 [00:36<00:27,  7.59it/s]Generating scenarios:  58%|█████▊    | 291/500 [00:36<00:26,  7.75it/s]Generating scenarios:  58%|█████▊    | 292/500 [00:36<00:26,  7.94it/s]Generating scenarios:  59%|█████▊    | 293/500 [00:37<00:26,  7.91it/s]Generating scenarios:  59%|█████▉    | 294/500 [00:37<00:25,  8.03it/s]Generating scenarios:  59%|█████▉    | 295/500 [00:37<00:25,  8.15it/s]Generating scenarios:  59%|█████▉    | 296/500 [00:37<00:25,  8.11it/s]Generating scenarios:  59%|█████▉    | 297/500 [00:37<00:25,  8.07it/s]Generating scenarios:  60%|█████▉    | 298/500 [00:37<00:26,  7.75it/s]Generating scenarios:  60%|█████▉    | 299/500 [00:37<00:30,  6.70it/s]Generating scenarios:  60%|██████    | 300/500 [00:38<00:28,  6.99it/s]Generating scenarios:  60%|██████    | 301/500 [00:38<00:27,  7.33it/s]Generating scenarios:  60%|██████    | 302/500 [00:38<00:26,  7.56it/s]Generating scenarios:  61%|██████    | 303/500 [00:38<00:25,  7.73it/s]Generating scenarios:  61%|██████    | 304/500 [00:38<00:31,  6.32it/s]Generating scenarios:  61%|██████    | 305/500 [00:38<00:28,  6.74it/s]Generating scenarios:  61%|██████    | 306/500 [00:38<00:27,  7.13it/s]Generating scenarios:  61%|██████▏   | 307/500 [00:39<00:25,  7.49it/s]Generating scenarios:  62%|██████▏   | 308/500 [00:39<00:25,  7.66it/s]Generating scenarios:  62%|██████▏   | 309/500 [00:39<00:24,  7.69it/s]Generating scenarios:  62%|██████▏   | 310/500 [00:39<00:24,  7.88it/s]Generating scenarios:  62%|██████▏   | 311/500 [00:39<00:24,  7.83it/s]Generating scenarios:  62%|██████▏   | 312/500 [00:39<00:22,  8.20it/s]Generating scenarios:  63%|██████▎   | 313/500 [00:39<00:22,  8.16it/s]Generating scenarios:  63%|██████▎   | 314/500 [00:39<00:23,  8.06it/s]Generating scenarios:  63%|██████▎   | 315/500 [00:39<00:22,  8.16it/s]Generating scenarios:  63%|██████▎   | 316/500 [00:40<00:23,  7.95it/s]Generating scenarios:  63%|██████▎   | 317/500 [00:40<00:23,  7.89it/s]Generating scenarios:  64%|██████▎   | 318/500 [00:40<00:22,  7.99it/s]Generating scenarios:  64%|██████▍   | 319/500 [00:40<00:21,  8.23it/s]Generating scenarios:  64%|██████▍   | 320/500 [00:40<00:21,  8.23it/s]Generating scenarios:  64%|██████▍   | 321/500 [00:40<00:21,  8.21it/s]Generating scenarios:  64%|██████▍   | 322/500 [00:40<00:21,  8.26it/s]Generating scenarios:  65%|██████▍   | 324/500 [00:41<00:20,  8.67it/s]Generating scenarios:  65%|██████▌   | 325/500 [00:41<00:20,  8.62it/s]Generating scenarios:  65%|██████▌   | 326/500 [00:41<00:20,  8.57it/s]Generating scenarios:  65%|██████▌   | 327/500 [00:41<00:19,  8.90it/s]Generating scenarios:  66%|██████▌   | 328/500 [00:41<00:19,  8.68it/s]Generating scenarios:  66%|██████▌   | 329/500 [00:41<00:20,  8.50it/s]Generating scenarios:  66%|██████▌   | 330/500 [00:41<00:20,  8.46it/s]Generating scenarios:  66%|██████▌   | 331/500 [00:41<00:20,  8.41it/s]Generating scenarios:  66%|██████▋   | 332/500 [00:42<00:20,  8.25it/s]Generating scenarios:  67%|██████▋   | 333/500 [00:42<00:20,  8.29it/s]Generating scenarios:  67%|██████▋   | 334/500 [00:42<00:20,  8.27it/s]Generating scenarios:  67%|██████▋   | 335/500 [00:42<00:19,  8.31it/s]Generating scenarios:  67%|██████▋   | 336/500 [00:42<00:20,  8.19it/s]Generating scenarios:  67%|██████▋   | 337/500 [00:42<00:19,  8.21it/s]Generating scenarios:  68%|██████▊   | 338/500 [00:42<00:19,  8.18it/s]Generating scenarios:  68%|██████▊   | 339/500 [00:42<00:19,  8.23it/s]Generating scenarios:  68%|██████▊   | 340/500 [00:42<00:19,  8.38it/s]Generating scenarios:  68%|██████▊   | 341/500 [00:43<00:19,  8.35it/s]Generating scenarios:  68%|██████▊   | 342/500 [00:43<00:18,  8.33it/s]Generating scenarios:  69%|██████▊   | 343/500 [00:43<00:18,  8.40it/s]Generating scenarios:  69%|██████▉   | 344/500 [00:43<00:18,  8.27it/s]Generating scenarios:  69%|██████▉   | 345/500 [00:43<00:18,  8.31it/s]Generating scenarios:  69%|██████▉   | 346/500 [00:43<00:18,  8.34it/s]Generating scenarios:  69%|██████▉   | 347/500 [00:43<00:18,  8.42it/s]Generating scenarios:  70%|██████▉   | 348/500 [00:43<00:18,  8.39it/s]Generating scenarios:  70%|██████▉   | 349/500 [00:44<00:17,  8.44it/s]Generating scenarios:  70%|███████   | 350/500 [00:44<00:17,  8.47it/s]Generating scenarios:  70%|███████   | 351/500 [00:44<00:17,  8.50it/s]Generating scenarios:  70%|███████   | 352/500 [00:44<00:17,  8.50it/s]Generating scenarios:  71%|███████   | 353/500 [00:44<00:17,  8.45it/s]Generating scenarios:  71%|███████   | 354/500 [00:44<00:17,  8.42it/s]Generating scenarios:  71%|███████   | 355/500 [00:44<00:17,  8.41it/s]Generating scenarios:  71%|███████   | 356/500 [00:44<00:17,  8.29it/s]Generating scenarios:  71%|███████▏  | 357/500 [00:45<00:17,  8.25it/s]Generating scenarios:  72%|███████▏  | 358/500 [00:45<00:17,  8.23it/s]Generating scenarios:  72%|███████▏  | 359/500 [00:45<00:17,  8.04it/s]Generating scenarios:  72%|███████▏  | 360/500 [00:45<00:17,  8.03it/s]Generating scenarios:  72%|███████▏  | 361/500 [00:45<00:17,  8.10it/s]Generating scenarios:  72%|███████▏  | 362/500 [00:45<00:16,  8.20it/s]Generating scenarios:  73%|███████▎  | 363/500 [00:45<00:17,  7.62it/s]Generating scenarios:  73%|███████▎  | 364/500 [00:45<00:17,  7.66it/s]Generating scenarios:  73%|███████▎  | 365/500 [00:46<00:17,  7.81it/s]Generating scenarios:  73%|███████▎  | 366/500 [00:46<00:17,  7.87it/s]Generating scenarios:  73%|███████▎  | 367/500 [00:46<00:15,  8.32it/s]Generating scenarios:  74%|███████▎  | 368/500 [00:46<00:15,  8.35it/s]Generating scenarios:  74%|███████▍  | 369/500 [00:46<00:15,  8.39it/s]Generating scenarios:  74%|███████▍  | 370/500 [00:46<00:15,  8.34it/s]Generating scenarios:  74%|███████▍  | 371/500 [00:46<00:15,  8.13it/s]Generating scenarios:  74%|███████▍  | 372/500 [00:46<00:15,  8.03it/s]Generating scenarios:  75%|███████▍  | 373/500 [00:46<00:15,  8.15it/s]Generating scenarios:  75%|███████▍  | 374/500 [00:47<00:15,  8.21it/s]Generating scenarios:  75%|███████▌  | 375/500 [00:47<00:15,  8.11it/s]Generating scenarios:  75%|███████▌  | 376/500 [00:47<00:15,  8.21it/s]Generating scenarios:  75%|███████▌  | 377/500 [00:47<00:14,  8.62it/s]Generating scenarios:  76%|███████▌  | 378/500 [00:47<00:14,  8.51it/s]Generating scenarios:  76%|███████▌  | 379/500 [00:47<00:14,  8.39it/s]Generating scenarios:  76%|███████▌  | 380/500 [00:47<00:14,  8.26it/s]Generating scenarios:  76%|███████▌  | 381/500 [00:47<00:14,  8.17it/s]Generating scenarios:  76%|███████▋  | 382/500 [00:48<00:14,  8.18it/s]Generating scenarios:  77%|███████▋  | 383/500 [00:48<00:14,  8.23it/s]Generating scenarios:  77%|███████▋  | 384/500 [00:48<00:14,  8.25it/s]Generating scenarios:  77%|███████▋  | 385/500 [00:48<00:14,  8.12it/s]Generating scenarios:  77%|███████▋  | 386/500 [00:48<00:13,  8.33it/s]Generating scenarios:  77%|███████▋  | 387/500 [00:48<00:13,  8.38it/s]Generating scenarios:  78%|███████▊  | 388/500 [00:48<00:13,  8.39it/s]Generating scenarios:  78%|███████▊  | 389/500 [00:48<00:13,  8.42it/s]Generating scenarios:  78%|███████▊  | 390/500 [00:49<00:12,  8.64it/s]Generating scenarios:  78%|███████▊  | 391/500 [00:49<00:12,  8.55it/s]Generating scenarios:  78%|███████▊  | 392/500 [00:49<00:12,  8.34it/s]Generating scenarios:  79%|███████▊  | 393/500 [00:49<00:12,  8.30it/s]Generating scenarios:  79%|███████▉  | 394/500 [00:49<00:12,  8.34it/s]Generating scenarios:  79%|███████▉  | 395/500 [00:49<00:12,  8.22it/s]Generating scenarios:  79%|███████▉  | 396/500 [00:49<00:12,  8.33it/s]Generating scenarios:  79%|███████▉  | 397/500 [00:49<00:12,  8.35it/s]Generating scenarios:  80%|███████▉  | 398/500 [00:49<00:12,  8.33it/s]Generating scenarios:  80%|███████▉  | 399/500 [00:50<00:12,  8.22it/s]Generating scenarios:  80%|████████  | 400/500 [00:50<00:12,  8.12it/s]Generating scenarios:  80%|████████  | 401/500 [00:50<00:12,  8.19it/s]Generating scenarios:  80%|████████  | 402/500 [00:50<00:12,  8.16it/s]Generating scenarios:  81%|████████  | 403/500 [00:50<00:13,  7.27it/s]Generating scenarios:  81%|████████  | 404/500 [00:50<00:12,  7.50it/s]Generating scenarios:  81%|████████  | 405/500 [00:50<00:12,  7.71it/s]Generating scenarios:  81%|████████  | 406/500 [00:51<00:11,  7.89it/s]Generating scenarios:  81%|████████▏ | 407/500 [00:51<00:15,  5.88it/s]Generating scenarios:  82%|████████▏ | 408/500 [00:51<00:14,  6.25it/s]Generating scenarios:  82%|████████▏ | 409/500 [00:51<00:13,  6.72it/s]Generating scenarios:  82%|████████▏ | 410/500 [00:51<00:12,  7.10it/s]Generating scenarios:  82%|████████▏ | 411/500 [00:51<00:12,  7.35it/s]Generating scenarios:  82%|████████▏ | 412/500 [00:51<00:11,  7.55it/s]Generating scenarios:  83%|████████▎ | 413/500 [00:52<00:11,  7.76it/s]Generating scenarios:  83%|████████▎ | 414/500 [00:52<00:10,  7.88it/s]Generating scenarios:  83%|████████▎ | 415/500 [00:52<00:10,  8.00it/s]Generating scenarios:  83%|████████▎ | 416/500 [00:52<00:10,  8.13it/s]Generating scenarios:  83%|████████▎ | 417/500 [00:52<00:10,  8.05it/s]Generating scenarios:  84%|████████▎ | 418/500 [00:52<00:10,  7.85it/s]Generating scenarios:  84%|████████▍ | 419/500 [00:52<00:10,  7.99it/s]Generating scenarios:  84%|████████▍ | 420/500 [00:52<00:09,  8.03it/s]Generating scenarios:  84%|████████▍ | 421/500 [00:53<00:09,  8.10it/s]Generating scenarios:  84%|████████▍ | 422/500 [00:53<00:10,  7.43it/s]Generating scenarios:  85%|████████▍ | 423/500 [00:53<00:10,  7.59it/s]Generating scenarios:  85%|████████▍ | 424/500 [00:53<00:09,  7.72it/s]Generating scenarios:  85%|████████▌ | 425/500 [00:53<00:09,  7.78it/s]Generating scenarios:  85%|████████▌ | 426/500 [00:53<00:09,  7.90it/s]Generating scenarios:  85%|████████▌ | 427/500 [00:53<00:09,  7.97it/s]Generating scenarios:  86%|████████▌ | 428/500 [00:53<00:08,  8.12it/s]Generating scenarios:  86%|████████▌ | 429/500 [00:54<00:08,  8.22it/s]Generating scenarios:  86%|████████▌ | 430/500 [00:54<00:08,  8.30it/s]Generating scenarios:  86%|████████▌ | 431/500 [00:54<00:08,  8.28it/s]Generating scenarios:  86%|████████▋ | 432/500 [00:54<00:08,  8.21it/s]Generating scenarios:  87%|████████▋ | 433/500 [00:54<00:08,  8.22it/s]Generating scenarios:  87%|████████▋ | 434/500 [00:54<00:08,  8.17it/s]Generating scenarios:  87%|████████▋ | 435/500 [00:54<00:07,  8.17it/s]Generating scenarios:  87%|████████▋ | 436/500 [00:54<00:07,  8.24it/s]Generating scenarios:  87%|████████▋ | 437/500 [00:55<00:07,  8.17it/s]Generating scenarios:  88%|████████▊ | 438/500 [00:55<00:07,  8.22it/s]Generating scenarios:  88%|████████▊ | 439/500 [00:55<00:07,  8.23it/s]Generating scenarios:  88%|████████▊ | 440/500 [00:55<00:07,  8.24it/s]Generating scenarios:  88%|████████▊ | 441/500 [00:55<00:07,  8.27it/s]Generating scenarios:  88%|████████▊ | 442/500 [00:55<00:06,  8.29it/s]Generating scenarios:  89%|████████▊ | 443/500 [00:55<00:06,  8.39it/s]Generating scenarios:  89%|████████▉ | 444/500 [00:55<00:06,  8.40it/s]Generating scenarios:  89%|████████▉ | 445/500 [00:55<00:06,  8.36it/s]Generating scenarios:  89%|████████▉ | 446/500 [00:56<00:06,  8.37it/s]Generating scenarios:  89%|████████▉ | 447/500 [00:56<00:06,  8.37it/s]Generating scenarios:  90%|████████▉ | 448/500 [00:56<00:06,  8.35it/s]Generating scenarios:  90%|████████▉ | 449/500 [00:56<00:06,  8.14it/s]Generating scenarios:  90%|█████████ | 450/500 [00:56<00:06,  8.13it/s]Generating scenarios:  90%|█████████ | 451/500 [00:56<00:06,  8.10it/s]Generating scenarios:  90%|█████████ | 452/500 [00:56<00:05,  8.04it/s]Generating scenarios:  91%|█████████ | 453/500 [00:56<00:05,  8.12it/s]Generating scenarios:  91%|█████████ | 454/500 [00:57<00:05,  8.12it/s]Generating scenarios:  91%|█████████ | 455/500 [00:57<00:05,  8.19it/s]Generating scenarios:  91%|█████████ | 456/500 [00:57<00:05,  8.21it/s]Generating scenarios:  91%|█████████▏| 457/500 [00:57<00:05,  8.15it/s]Generating scenarios:  92%|█████████▏| 458/500 [00:57<00:05,  8.24it/s]Generating scenarios:  92%|█████████▏| 459/500 [00:57<00:04,  8.21it/s]Generating scenarios:  92%|█████████▏| 460/500 [00:57<00:04,  8.16it/s]Generating scenarios:  92%|█████████▏| 461/500 [00:57<00:04,  8.19it/s]Generating scenarios:  92%|█████████▏| 462/500 [00:58<00:04,  8.15it/s]Generating scenarios:  93%|█████████▎| 463/500 [00:58<00:04,  8.24it/s]Generating scenarios:  93%|█████████▎| 464/500 [00:58<00:04,  8.28it/s]Generating scenarios:  93%|█████████▎| 465/500 [00:58<00:04,  8.36it/s]Generating scenarios:  93%|█████████▎| 466/500 [00:58<00:04,  8.41it/s]Generating scenarios:  93%|█████████▎| 467/500 [00:58<00:03,  8.38it/s]Generating scenarios:  94%|█████████▎| 468/500 [00:58<00:03,  8.32it/s]Generating scenarios:  94%|█████████▍| 469/500 [00:58<00:03,  8.32it/s]Generating scenarios:  94%|█████████▍| 470/500 [00:59<00:03,  8.33it/s]Generating scenarios:  94%|█████████▍| 471/500 [00:59<00:03,  8.34it/s]Generating scenarios:  94%|█████████▍| 472/500 [00:59<00:03,  8.34it/s]Generating scenarios:  95%|█████████▍| 473/500 [00:59<00:03,  8.33it/s]Generating scenarios:  95%|█████████▍| 474/500 [00:59<00:03,  8.33it/s]Generating scenarios:  95%|█████████▌| 475/500 [00:59<00:02,  8.41it/s]Generating scenarios:  95%|█████████▌| 476/500 [00:59<00:02,  8.40it/s]Generating scenarios:  95%|█████████▌| 477/500 [00:59<00:02,  8.44it/s]Generating scenarios:  96%|█████████▌| 478/500 [00:59<00:02,  8.46it/s]Generating scenarios:  96%|█████████▌| 479/500 [01:00<00:02,  8.52it/s]Generating scenarios:  96%|█████████▌| 480/500 [01:00<00:02,  8.18it/s]Generating scenarios:  96%|█████████▌| 481/500 [01:00<00:02,  8.14it/s]Generating scenarios:  96%|█████████▋| 482/500 [01:00<00:02,  8.27it/s]Generating scenarios:  97%|█████████▋| 483/500 [01:00<00:02,  8.26it/s]Generating scenarios:  97%|█████████▋| 484/500 [01:00<00:01,  8.22it/s]Generating scenarios:  97%|█████████▋| 485/500 [01:00<00:01,  8.26it/s]Generating scenarios:  97%|█████████▋| 486/500 [01:00<00:01,  8.29it/s]Generating scenarios:  97%|█████████▋| 487/500 [01:01<00:01,  8.32it/s]Generating scenarios:  98%|█████████▊| 488/500 [01:01<00:01,  8.28it/s]Generating scenarios:  98%|█████████▊| 489/500 [01:01<00:01,  8.20it/s]Generating scenarios:  98%|█████████▊| 490/500 [01:01<00:01,  8.23it/s]Generating scenarios:  98%|█████████▊| 491/500 [01:01<00:01,  8.20it/s]Generating scenarios:  98%|█████████▊| 492/500 [01:01<00:00,  8.15it/s]Generating scenarios:  99%|█████████▊| 493/500 [01:01<00:00,  8.15it/s]Generating scenarios:  99%|█████████▉| 494/500 [01:01<00:00,  8.17it/s]Generating scenarios:  99%|█████████▉| 495/500 [01:02<00:00,  8.16it/s]Generating scenarios:  99%|█████████▉| 496/500 [01:02<00:00,  8.21it/s]Generating scenarios:  99%|█████████▉| 497/500 [01:02<00:00,  8.26it/s]Generating scenarios: 100%|█████████▉| 498/500 [01:02<00:00,  8.35it/s]Generating scenarios: 100%|█████████▉| 499/500 [01:02<00:00,  8.33it/s]Generating scenarios: 100%|██████████| 500/500 [01:02<00:00,  8.41it/s]Generating scenarios: 100%|██████████| 500/500 [01:02<00:00,  7.98it/s]

======================================================================
GENERATION SUMMARY
======================================================================
Total scenarios: 500
Output directory: ml/data/synthetic_bank_priority2

By Archetype:
archetype
A    100
B    100
C    100
D    100
E    100
Name: count, dtype: int64

By Hospital Size:
hospital_size
small     170
large     165
medium    165
Name: count, dtype: int64

By Archetype and Size:
hospital_size  large  medium  small
archetype                          
A                 33      33     34
B                 33      33     34
C                 33      33     34
D                 33      33     34
E                 33      33     34

Files generated:
  Train files: 500
  Test files: 500
  Manifest: 1
  Total: 1001

✓ Generation complete!

Next steps:
  1. Review manifest: ml/data/synthetic_bank_priority2/DATASET_MANIFEST.csv
  2. Verify data quality and statistics
  3. Use datasets for ML training and evaluation
