/Users/hnxnq712/.matplotlib is not a writable directory
Matplotlib created a temporary cache directory at /var/folders/6h/z0k1dl5j58x7_y6pppch5gm00000gn/T/matplotlib-yg3iilp5 because there was an issue with the default path (/Users/hnxnq712/.matplotlib); it is highly recommended to set the MPLCONFIGDIR environment variable to a writable directory, in particular to speed up the import of Matplotlib and to better support multiprocessing.
Training on 50 datasets: ['A1', 'A10', 'A2', 'A3', 'A4', 'A5', 'A6', 'A7', 'A8', 'A9', 'B1', 'B10', 'B2', 'B3', 'B4', 'B5', 'B6', 'B7', 'B8', 'B9', 'C1', 'C10', 'C2', 'C3', 'C4', 'C5', 'C6', 'C7', 'C8', 'C9', 'D1', 'D10', 'D2', 'D3', 'D4', 'D5', 'D6', 'D7', 'D8', 'D9', 'E1', 'E10', 'E2', 'E3', 'E4', 'E5', 'E6', 'E7', 'E8', 'E9']

============================================================
Dataset: A1, Horizon: 14, Objective: l2
============================================================
Train: 731 rows (2023-01-01 00:00:00 to 2024-12-31 00:00:00)
Test: 365 rows (2025-01-01 00:00:00 to 2025-12-31 00:00:00)
Warning: Some feature columns not found: ['trend_slope_7d', 'trend_slope_14d', 'trend_slope_30d', 'momentum_7d', 'momentum_14d', 'momentum_30d', 'trend_up_7d', 'trend_up_14d', 'trend_up_30d', 'trend_strength_7d', 'trend_strength_14d', 'trend_strength_30d']
Features: 19 (total_onsite_units, expired_units, used_units, newly_added_units, ordered_units...)
Train samples: 717, Test samples: 351
Train split: 627, Validation: 90

Training model...
Training until validation scores don't improve for 50 rounds
Early stopping, best iteration is:
[35]	train's rmse: 17.0819	val's rmse: 36.2639

Evaluating on test set...
Normalized MAE: 0.0313, Stockout Rate: 0.00%, MAPE: 3.1%
Saved model to ml/models_priority3_all/A1/model_h14_l2.txt
Saved feature importance to ml/models_priority3_all/A1/feature_importance_h14_l2.csv
Saved predictions to ml/models_priority3_all/A1/predictions_h14_l2.csv
Saved metrics to ml/models_priority3_all/A1/metrics_h14_l2.json

============================================================
Dataset: A10, Horizon: 14, Objective: l2
============================================================
Train: 731 rows (2023-01-01 00:00:00 to 2024-12-31 00:00:00)
Test: 365 rows (2025-01-01 00:00:00 to 2025-12-31 00:00:00)
Warning: Some feature columns not found: ['trend_slope_7d', 'trend_slope_14d', 'trend_slope_30d', 'momentum_7d', 'momentum_14d', 'momentum_30d', 'trend_up_7d', 'trend_up_14d', 'trend_up_30d', 'trend_strength_7d', 'trend_strength_14d', 'trend_strength_30d']
Features: 19 (total_onsite_units, expired_units, used_units, newly_added_units, ordered_units...)
Train samples: 717, Test samples: 351
Train split: 627, Validation: 90

Training model...
Training until validation scores don't improve for 50 rounds
Early stopping, best iteration is:
[1]	train's rmse: 27.4395	val's rmse: 31.8387

Evaluating on test set...
Normalized MAE: 0.0259, Stockout Rate: 0.00%, MAPE: 2.6%
Saved model to ml/models_priority3_all/A10/model_h14_l2.txt
Saved feature importance to ml/models_priority3_all/A10/feature_importance_h14_l2.csv
Saved predictions to ml/models_priority3_all/A10/predictions_h14_l2.csv
Saved metrics to ml/models_priority3_all/A10/metrics_h14_l2.json

============================================================
Dataset: A2, Horizon: 14, Objective: l2
============================================================
Train: 731 rows (2023-01-01 00:00:00 to 2024-12-31 00:00:00)
Test: 365 rows (2025-01-01 00:00:00 to 2025-12-31 00:00:00)
Warning: Some feature columns not found: ['trend_slope_7d', 'trend_slope_14d', 'trend_slope_30d', 'momentum_7d', 'momentum_14d', 'momentum_30d', 'trend_up_7d', 'trend_up_14d', 'trend_up_30d', 'trend_strength_7d', 'trend_strength_14d', 'trend_strength_30d']
Features: 19 (total_onsite_units, expired_units, used_units, newly_added_units, ordered_units...)
Train samples: 717, Test samples: 351
Train split: 627, Validation: 90

Training model...
Training until validation scores don't improve for 50 rounds
Early stopping, best iteration is:
[1]	train's rmse: 34.347	val's rmse: 25.752

Evaluating on test set...
Normalized MAE: 0.0254, Stockout Rate: 0.28%, MAPE: 2.5%
Saved model to ml/models_priority3_all/A2/model_h14_l2.txt
Saved feature importance to ml/models_priority3_all/A2/feature_importance_h14_l2.csv
Saved predictions to ml/models_priority3_all/A2/predictions_h14_l2.csv
Saved metrics to ml/models_priority3_all/A2/metrics_h14_l2.json

============================================================
Dataset: A3, Horizon: 14, Objective: l2
============================================================
Train: 731 rows (2023-01-01 00:00:00 to 2024-12-31 00:00:00)
Test: 365 rows (2025-01-01 00:00:00 to 2025-12-31 00:00:00)
Warning: Some feature columns not found: ['trend_slope_7d', 'trend_slope_14d', 'trend_slope_30d', 'momentum_7d', 'momentum_14d', 'momentum_30d', 'trend_up_7d', 'trend_up_14d', 'trend_up_30d', 'trend_strength_7d', 'trend_strength_14d', 'trend_strength_30d']
Features: 19 (total_onsite_units, expired_units, used_units, newly_added_units, ordered_units...)
Train samples: 717, Test samples: 351
Train split: 627, Validation: 90

Training model...
Training until validation scores don't improve for 50 rounds
Early stopping, best iteration is:
[29]	train's rmse: 19.0193	val's rmse: 42.4758

Evaluating on test set...
Normalized MAE: 0.0348, Stockout Rate: 0.00%, MAPE: 3.4%
Saved model to ml/models_priority3_all/A3/model_h14_l2.txt
Saved feature importance to ml/models_priority3_all/A3/feature_importance_h14_l2.csv
Saved predictions to ml/models_priority3_all/A3/predictions_h14_l2.csv
Saved metrics to ml/models_priority3_all/A3/metrics_h14_l2.json

============================================================
Dataset: A4, Horizon: 14, Objective: l2
============================================================
Train: 731 rows (2023-01-01 00:00:00 to 2024-12-31 00:00:00)
Test: 365 rows (2025-01-01 00:00:00 to 2025-12-31 00:00:00)
Warning: Some feature columns not found: ['trend_slope_7d', 'trend_slope_14d', 'trend_slope_30d', 'momentum_7d', 'momentum_14d', 'momentum_30d', 'trend_up_7d', 'trend_up_14d', 'trend_up_30d', 'trend_strength_7d', 'trend_strength_14d', 'trend_strength_30d']
Features: 19 (total_onsite_units, expired_units, used_units, newly_added_units, ordered_units...)
Train samples: 717, Test samples: 351
Train split: 627, Validation: 90

Training model...
Training until validation scores don't improve for 50 rounds
Early stopping, best iteration is:
[1]	train's rmse: 23.1032	val's rmse: 23.16

Evaluating on test set...
Normalized MAE: 0.0366, Stockout Rate: 0.00%, MAPE: 3.7%
Saved model to ml/models_priority3_all/A4/model_h14_l2.txt
Saved feature importance to ml/models_priority3_all/A4/feature_importance_h14_l2.csv
Saved predictions to ml/models_priority3_all/A4/predictions_h14_l2.csv
Saved metrics to ml/models_priority3_all/A4/metrics_h14_l2.json

============================================================
Dataset: A5, Horizon: 14, Objective: l2
============================================================
Train: 731 rows (2023-01-01 00:00:00 to 2024-12-31 00:00:00)
Test: 365 rows (2025-01-01 00:00:00 to 2025-12-31 00:00:00)
Warning: Some feature columns not found: ['trend_slope_7d', 'trend_slope_14d', 'trend_slope_30d', 'momentum_7d', 'momentum_14d', 'momentum_30d', 'trend_up_7d', 'trend_up_14d', 'trend_up_30d', 'trend_strength_7d', 'trend_strength_14d', 'trend_strength_30d']
Features: 19 (total_onsite_units, expired_units, used_units, newly_added_units, ordered_units...)
Train samples: 717, Test samples: 351
Train split: 627, Validation: 90

Training model...
Training until validation scores don't improve for 50 rounds
Early stopping, best iteration is:
[8]	train's rmse: 29.5094	val's rmse: 28.1834

Evaluating on test set...
Normalized MAE: 0.0334, Stockout Rate: 0.00%, MAPE: 3.4%
Saved model to ml/models_priority3_all/A5/model_h14_l2.txt
Saved feature importance to ml/models_priority3_all/A5/feature_importance_h14_l2.csv
Saved predictions to ml/models_priority3_all/A5/predictions_h14_l2.csv
Saved metrics to ml/models_priority3_all/A5/metrics_h14_l2.json

============================================================
Dataset: A6, Horizon: 14, Objective: l2
============================================================
Train: 731 rows (2023-01-01 00:00:00 to 2024-12-31 00:00:00)
Test: 365 rows (2025-01-01 00:00:00 to 2025-12-31 00:00:00)
Warning: Some feature columns not found: ['trend_slope_7d', 'trend_slope_14d', 'trend_slope_30d', 'momentum_7d', 'momentum_14d', 'momentum_30d', 'trend_up_7d', 'trend_up_14d', 'trend_up_30d', 'trend_strength_7d', 'trend_strength_14d', 'trend_strength_30d']
Features: 19 (total_onsite_units, expired_units, used_units, newly_added_units, ordered_units...)
Train samples: 717, Test samples: 351
Train split: 627, Validation: 90

Training model...
Training until validation scores don't improve for 50 rounds
[100]	train's rmse: 10.046	val's rmse: 22.5921
Early stopping, best iteration is:
[65]	train's rmse: 12.2895	val's rmse: 21.9027

Evaluating on test set...
Normalized MAE: 0.0393, Stockout Rate: 0.00%, MAPE: 3.9%
Saved model to ml/models_priority3_all/A6/model_h14_l2.txt
Saved feature importance to ml/models_priority3_all/A6/feature_importance_h14_l2.csv
Saved predictions to ml/models_priority3_all/A6/predictions_h14_l2.csv
Saved metrics to ml/models_priority3_all/A6/metrics_h14_l2.json

============================================================
Dataset: A7, Horizon: 14, Objective: l2
============================================================
Train: 731 rows (2023-01-01 00:00:00 to 2024-12-31 00:00:00)
Test: 365 rows (2025-01-01 00:00:00 to 2025-12-31 00:00:00)
Warning: Some feature columns not found: ['trend_slope_7d', 'trend_slope_14d', 'trend_slope_30d', 'momentum_7d', 'momentum_14d', 'momentum_30d', 'trend_up_7d', 'trend_up_14d', 'trend_up_30d', 'trend_strength_7d', 'trend_strength_14d', 'trend_strength_30d']
Features: 19 (total_onsite_units, expired_units, used_units, newly_added_units, ordered_units...)
Train samples: 717, Test samples: 351
Train split: 627, Validation: 90

Training model...
Training until validation scores don't improve for 50 rounds
Early stopping, best iteration is:
[1]	train's rmse: 20.5971	val's rmse: 28.9062

Evaluating on test set...
Normalized MAE: 0.0313, Stockout Rate: 0.00%, MAPE: 3.1%
Saved model to ml/models_priority3_all/A7/model_h14_l2.txt
Saved feature importance to ml/models_priority3_all/A7/feature_importance_h14_l2.csv
Saved predictions to ml/models_priority3_all/A7/predictions_h14_l2.csv
Saved metrics to ml/models_priority3_all/A7/metrics_h14_l2.json

============================================================
Dataset: A8, Horizon: 14, Objective: l2
============================================================
Train: 731 rows (2023-01-01 00:00:00 to 2024-12-31 00:00:00)
Test: 365 rows (2025-01-01 00:00:00 to 2025-12-31 00:00:00)
Warning: Some feature columns not found: ['trend_slope_7d', 'trend_slope_14d', 'trend_slope_30d', 'momentum_7d', 'momentum_14d', 'momentum_30d', 'trend_up_7d', 'trend_up_14d', 'trend_up_30d', 'trend_strength_7d', 'trend_strength_14d', 'trend_strength_30d']
Features: 19 (total_onsite_units, expired_units, used_units, newly_added_units, ordered_units...)
Train samples: 717, Test samples: 351
Train split: 627, Validation: 90

Training model...
Training until validation scores don't improve for 50 rounds
Early stopping, best iteration is:
[5]	train's rmse: 29.6617	val's rmse: 36.8422

Evaluating on test set...
Normalized MAE: 0.0495, Stockout Rate: 0.00%, MAPE: 5.0%
Saved model to ml/models_priority3_all/A8/model_h14_l2.txt
Saved feature importance to ml/models_priority3_all/A8/feature_importance_h14_l2.csv
Saved predictions to ml/models_priority3_all/A8/predictions_h14_l2.csv
Saved metrics to ml/models_priority3_all/A8/metrics_h14_l2.json

============================================================
Dataset: A9, Horizon: 14, Objective: l2
============================================================
Train: 731 rows (2023-01-01 00:00:00 to 2024-12-31 00:00:00)
Test: 365 rows (2025-01-01 00:00:00 to 2025-12-31 00:00:00)
Warning: Some feature columns not found: ['trend_slope_7d', 'trend_slope_14d', 'trend_slope_30d', 'momentum_7d', 'momentum_14d', 'momentum_30d', 'trend_up_7d', 'trend_up_14d', 'trend_up_30d', 'trend_strength_7d', 'trend_strength_14d', 'trend_strength_30d']
Features: 19 (total_onsite_units, expired_units, used_units, newly_added_units, ordered_units...)
Train samples: 717, Test samples: 351
Train split: 627, Validation: 90

Training model...
Training until validation scores don't improve for 50 rounds
Early stopping, best iteration is:
[30]	train's rmse: 13.5895	val's rmse: 41.6884

Evaluating on test set...
Normalized MAE: 0.0359, Stockout Rate: 0.00%, MAPE: 3.6%
Saved model to ml/models_priority3_all/A9/model_h14_l2.txt
Saved feature importance to ml/models_priority3_all/A9/feature_importance_h14_l2.csv
Saved predictions to ml/models_priority3_all/A9/predictions_h14_l2.csv
Saved metrics to ml/models_priority3_all/A9/metrics_h14_l2.json

============================================================
Dataset: B1, Horizon: 14, Objective: l2
============================================================
Train: 731 rows (2023-01-01 00:00:00 to 2024-12-31 00:00:00)
Test: 365 rows (2025-01-01 00:00:00 to 2025-12-31 00:00:00)
Warning: Some feature columns not found: ['trend_slope_7d', 'trend_slope_14d', 'trend_slope_30d', 'momentum_7d', 'momentum_14d', 'momentum_30d', 'trend_up_7d', 'trend_up_14d', 'trend_up_30d', 'trend_strength_7d', 'trend_strength_14d', 'trend_strength_30d']
Features: 19 (total_onsite_units, expired_units, used_units, newly_added_units, ordered_units...)
Train samples: 717, Test samples: 351
Train split: 627, Validation: 90

Training model...
Training until validation scores don't improve for 50 rounds
Early stopping, best iteration is:
[3]	train's rmse: 6.11105	val's rmse: 2.65449

Evaluating on test set...
Normalized MAE: 0.4519, Stockout Rate: 0.00%, MAPE: 80.4%
Saved model to ml/models_priority3_all/B1/model_h14_l2.txt
Saved feature importance to ml/models_priority3_all/B1/feature_importance_h14_l2.csv
Saved predictions to ml/models_priority3_all/B1/predictions_h14_l2.csv
Saved metrics to ml/models_priority3_all/B1/metrics_h14_l2.json

============================================================
Dataset: B10, Horizon: 14, Objective: l2
============================================================
Train: 731 rows (2023-01-01 00:00:00 to 2024-12-31 00:00:00)
Test: 365 rows (2025-01-01 00:00:00 to 2025-12-31 00:00:00)
Warning: Some feature columns not found: ['trend_slope_7d', 'trend_slope_14d', 'trend_slope_30d', 'momentum_7d', 'momentum_14d', 'momentum_30d', 'trend_up_7d', 'trend_up_14d', 'trend_up_30d', 'trend_strength_7d', 'trend_strength_14d', 'trend_strength_30d']
Features: 19 (total_onsite_units, expired_units, used_units, newly_added_units, ordered_units...)
Train samples: 717, Test samples: 351
Train split: 627, Validation: 90

Training model...
Training until validation scores don't improve for 50 rounds
Early stopping, best iteration is:
[1]	train's rmse: 5.40056	val's rmse: 11.1508

Evaluating on test set...
Normalized MAE: 0.4123, Stockout Rate: 0.00%, MAPE: 62.8%
Saved model to ml/models_priority3_all/B10/model_h14_l2.txt
Saved feature importance to ml/models_priority3_all/B10/feature_importance_h14_l2.csv
Saved predictions to ml/models_priority3_all/B10/predictions_h14_l2.csv
Saved metrics to ml/models_priority3_all/B10/metrics_h14_l2.json

============================================================
Dataset: B2, Horizon: 14, Objective: l2
============================================================
Train: 731 rows (2023-01-01 00:00:00 to 2024-12-31 00:00:00)
Test: 365 rows (2025-01-01 00:00:00 to 2025-12-31 00:00:00)
Warning: Some feature columns not found: ['trend_slope_7d', 'trend_slope_14d', 'trend_slope_30d', 'momentum_7d', 'momentum_14d', 'momentum_30d', 'trend_up_7d', 'trend_up_14d', 'trend_up_30d', 'trend_strength_7d', 'trend_strength_14d', 'trend_strength_30d']
Features: 19 (total_onsite_units, expired_units, used_units, newly_added_units, ordered_units...)
Train samples: 717, Test samples: 351
Train split: 627, Validation: 90

Training model...
Training until validation scores don't improve for 50 rounds
Early stopping, best iteration is:
[1]	train's rmse: 2.27263	val's rmse: 1.36657

Evaluating on test set...
Normalized MAE: 0.7911, Stockout Rate: 0.00%, MAPE: 62.8%
Saved model to ml/models_priority3_all/B2/model_h14_l2.txt
Saved feature importance to ml/models_priority3_all/B2/feature_importance_h14_l2.csv
Saved predictions to ml/models_priority3_all/B2/predictions_h14_l2.csv
Saved metrics to ml/models_priority3_all/B2/metrics_h14_l2.json

============================================================
Dataset: B3, Horizon: 14, Objective: l2
============================================================
Train: 731 rows (2023-01-01 00:00:00 to 2024-12-31 00:00:00)
Test: 365 rows (2025-01-01 00:00:00 to 2025-12-31 00:00:00)
Warning: Some feature columns not found: ['trend_slope_7d', 'trend_slope_14d', 'trend_slope_30d', 'momentum_7d', 'momentum_14d', 'momentum_30d', 'trend_up_7d', 'trend_up_14d', 'trend_up_30d', 'trend_strength_7d', 'trend_strength_14d', 'trend_strength_30d']
Features: 19 (total_onsite_units, expired_units, used_units, newly_added_units, ordered_units...)
Train samples: 717, Test samples: 351
Train split: 627, Validation: 90

Training model...
Training until validation scores don't improve for 50 rounds
Early stopping, best iteration is:
[1]	train's rmse: 4.32699	val's rmse: 2.32893

Evaluating on test set...
Normalized MAE: 0.7531, Stockout Rate: 0.00%, MAPE: 115.0%
Saved model to ml/models_priority3_all/B3/model_h14_l2.txt
Saved feature importance to ml/models_priority3_all/B3/feature_importance_h14_l2.csv
Saved predictions to ml/models_priority3_all/B3/predictions_h14_l2.csv
Saved metrics to ml/models_priority3_all/B3/metrics_h14_l2.json

============================================================
Dataset: B4, Horizon: 14, Objective: l2
============================================================
Train: 731 rows (2023-01-01 00:00:00 to 2024-12-31 00:00:00)
Test: 365 rows (2025-01-01 00:00:00 to 2025-12-31 00:00:00)
Warning: Some feature columns not found: ['trend_slope_7d', 'trend_slope_14d', 'trend_slope_30d', 'momentum_7d', 'momentum_14d', 'momentum_30d', 'trend_up_7d', 'trend_up_14d', 'trend_up_30d', 'trend_strength_7d', 'trend_strength_14d', 'trend_strength_30d']
Features: 19 (total_onsite_units, expired_units, used_units, newly_added_units, ordered_units...)
Train samples: 717, Test samples: 351
Train split: 627, Validation: 90

Training model...
Training until validation scores don't improve for 50 rounds
[100]	train's rmse: 1.55554	val's rmse: 2.6718
Early stopping, best iteration is:
[94]	train's rmse: 1.61704	val's rmse: 2.62989

Evaluating on test set...
Normalized MAE: 0.4876, Stockout Rate: 0.28%, MAPE: 48.1%
Saved model to ml/models_priority3_all/B4/model_h14_l2.txt
Saved feature importance to ml/models_priority3_all/B4/feature_importance_h14_l2.csv
Saved predictions to ml/models_priority3_all/B4/predictions_h14_l2.csv
Saved metrics to ml/models_priority3_all/B4/metrics_h14_l2.json

============================================================
Dataset: B5, Horizon: 14, Objective: l2
============================================================
Train: 731 rows (2023-01-01 00:00:00 to 2024-12-31 00:00:00)
Test: 365 rows (2025-01-01 00:00:00 to 2025-12-31 00:00:00)
Warning: Some feature columns not found: ['trend_slope_7d', 'trend_slope_14d', 'trend_slope_30d', 'momentum_7d', 'momentum_14d', 'momentum_30d', 'trend_up_7d', 'trend_up_14d', 'trend_up_30d', 'trend_strength_7d', 'trend_strength_14d', 'trend_strength_30d']
Features: 19 (total_onsite_units, expired_units, used_units, newly_added_units, ordered_units...)
Train samples: 717, Test samples: 351
Train split: 627, Validation: 90

Training model...
Training until validation scores don't improve for 50 rounds
Early stopping, best iteration is:
[4]	train's rmse: 1.84588	val's rmse: 2.09389

Evaluating on test set...
Normalized MAE: 0.6998, Stockout Rate: 0.00%, MAPE: 74.6%
Saved model to ml/models_priority3_all/B5/model_h14_l2.txt
Saved feature importance to ml/models_priority3_all/B5/feature_importance_h14_l2.csv
Saved predictions to ml/models_priority3_all/B5/predictions_h14_l2.csv
Saved metrics to ml/models_priority3_all/B5/metrics_h14_l2.json

============================================================
Dataset: B6, Horizon: 14, Objective: l2
============================================================
Train: 731 rows (2023-01-01 00:00:00 to 2024-12-31 00:00:00)
Test: 365 rows (2025-01-01 00:00:00 to 2025-12-31 00:00:00)
Warning: Some feature columns not found: ['trend_slope_7d', 'trend_slope_14d', 'trend_slope_30d', 'momentum_7d', 'momentum_14d', 'momentum_30d', 'trend_up_7d', 'trend_up_14d', 'trend_up_30d', 'trend_strength_7d', 'trend_strength_14d', 'trend_strength_30d']
Features: 19 (total_onsite_units, expired_units, used_units, newly_added_units, ordered_units...)
Train samples: 717, Test samples: 351
Train split: 627, Validation: 90

Training model...
Training until validation scores don't improve for 50 rounds
Early stopping, best iteration is:
[4]	train's rmse: 3.80775	val's rmse: 1.55938

Evaluating on test set...
Normalized MAE: 1.1915, Stockout Rate: 0.00%, MAPE: 90.1%
Saved model to ml/models_priority3_all/B6/model_h14_l2.txt
Saved feature importance to ml/models_priority3_all/B6/feature_importance_h14_l2.csv
Saved predictions to ml/models_priority3_all/B6/predictions_h14_l2.csv
Saved metrics to ml/models_priority3_all/B6/metrics_h14_l2.json

============================================================
Dataset: B7, Horizon: 14, Objective: l2
============================================================
Train: 731 rows (2023-01-01 00:00:00 to 2024-12-31 00:00:00)
Test: 365 rows (2025-01-01 00:00:00 to 2025-12-31 00:00:00)
Warning: Some feature columns not found: ['trend_slope_7d', 'trend_slope_14d', 'trend_slope_30d', 'momentum_7d', 'momentum_14d', 'momentum_30d', 'trend_up_7d', 'trend_up_14d', 'trend_up_30d', 'trend_strength_7d', 'trend_strength_14d', 'trend_strength_30d']
Features: 19 (total_onsite_units, expired_units, used_units, newly_added_units, ordered_units...)
Train samples: 717, Test samples: 351
Train split: 627, Validation: 90

Training model...
Training until validation scores don't improve for 50 rounds
Early stopping, best iteration is:
[42]	train's rmse: 1.52837	val's rmse: 9.42902

Evaluating on test set...
Normalized MAE: 1.1808, Stockout Rate: 0.00%, MAPE: 94.5%
Saved model to ml/models_priority3_all/B7/model_h14_l2.txt
Saved feature importance to ml/models_priority3_all/B7/feature_importance_h14_l2.csv
Saved predictions to ml/models_priority3_all/B7/predictions_h14_l2.csv
Saved metrics to ml/models_priority3_all/B7/metrics_h14_l2.json

============================================================
Dataset: B8, Horizon: 14, Objective: l2
============================================================
Train: 731 rows (2023-01-01 00:00:00 to 2024-12-31 00:00:00)
Test: 365 rows (2025-01-01 00:00:00 to 2025-12-31 00:00:00)
Warning: Some feature columns not found: ['trend_slope_7d', 'trend_slope_14d', 'trend_slope_30d', 'momentum_7d', 'momentum_14d', 'momentum_30d', 'trend_up_7d', 'trend_up_14d', 'trend_up_30d', 'trend_strength_7d', 'trend_strength_14d', 'trend_strength_30d']
Features: 19 (total_onsite_units, expired_units, used_units, newly_added_units, ordered_units...)
Train samples: 717, Test samples: 351
Train split: 627, Validation: 90

Training model...
Training until validation scores don't improve for 50 rounds
Early stopping, best iteration is:
[3]	train's rmse: 4.20786	val's rmse: 3.57203

Evaluating on test set...
Normalized MAE: 0.8160, Stockout Rate: 0.00%, MAPE: 121.9%
Saved model to ml/models_priority3_all/B8/model_h14_l2.txt
Saved feature importance to ml/models_priority3_all/B8/feature_importance_h14_l2.csv
Saved predictions to ml/models_priority3_all/B8/predictions_h14_l2.csv
Saved metrics to ml/models_priority3_all/B8/metrics_h14_l2.json

============================================================
Dataset: B9, Horizon: 14, Objective: l2
============================================================
Train: 731 rows (2023-01-01 00:00:00 to 2024-12-31 00:00:00)
Test: 365 rows (2025-01-01 00:00:00 to 2025-12-31 00:00:00)
Warning: Some feature columns not found: ['trend_slope_7d', 'trend_slope_14d', 'trend_slope_30d', 'momentum_7d', 'momentum_14d', 'momentum_30d', 'trend_up_7d', 'trend_up_14d', 'trend_up_30d', 'trend_strength_7d', 'trend_strength_14d', 'trend_strength_30d']
Features: 19 (total_onsite_units, expired_units, used_units, newly_added_units, ordered_units...)
Train samples: 717, Test samples: 351
Train split: 627, Validation: 90

Training model...
Training until validation scores don't improve for 50 rounds
[100]	train's rmse: 0.913385	val's rmse: 7.4612
Early stopping, best iteration is:
[145]	train's rmse: 0.778586	val's rmse: 7.40715

Evaluating on test set...
Normalized MAE: 0.8125, Stockout Rate: 0.00%, MAPE: 96.0%
Saved model to ml/models_priority3_all/B9/model_h14_l2.txt
Saved feature importance to ml/models_priority3_all/B9/feature_importance_h14_l2.csv
Saved predictions to ml/models_priority3_all/B9/predictions_h14_l2.csv
Saved metrics to ml/models_priority3_all/B9/metrics_h14_l2.json

============================================================
Dataset: C1, Horizon: 14, Objective: l2
============================================================
Train: 731 rows (2023-01-01 00:00:00 to 2024-12-31 00:00:00)
Test: 365 rows (2025-01-01 00:00:00 to 2025-12-31 00:00:00)
Warning: Some feature columns not found: ['trend_slope_7d', 'trend_slope_14d', 'trend_slope_30d', 'momentum_7d', 'momentum_14d', 'momentum_30d', 'trend_up_7d', 'trend_up_14d', 'trend_up_30d', 'trend_strength_7d', 'trend_strength_14d', 'trend_strength_30d']
Features: 19 (total_onsite_units, expired_units, used_units, newly_added_units, ordered_units...)
Train samples: 717, Test samples: 351
Train split: 627, Validation: 90

Training model...
Training until validation scores don't improve for 50 rounds
[100]	train's rmse: 6.62863	val's rmse: 21.2712
Early stopping, best iteration is:
[66]	train's rmse: 8.23487	val's rmse: 20.9638

Evaluating on test set...
Normalized MAE: 0.0570, Stockout Rate: 0.00%, MAPE: 5.8%
Saved model to ml/models_priority3_all/C1/model_h14_l2.txt
Saved feature importance to ml/models_priority3_all/C1/feature_importance_h14_l2.csv
Saved predictions to ml/models_priority3_all/C1/predictions_h14_l2.csv
Saved metrics to ml/models_priority3_all/C1/metrics_h14_l2.json

============================================================
Dataset: C10, Horizon: 14, Objective: l2
============================================================
Train: 731 rows (2023-01-01 00:00:00 to 2024-12-31 00:00:00)
Test: 365 rows (2025-01-01 00:00:00 to 2025-12-31 00:00:00)
Warning: Some feature columns not found: ['trend_slope_7d', 'trend_slope_14d', 'trend_slope_30d', 'momentum_7d', 'momentum_14d', 'momentum_30d', 'trend_up_7d', 'trend_up_14d', 'trend_up_30d', 'trend_strength_7d', 'trend_strength_14d', 'trend_strength_30d']
Features: 19 (total_onsite_units, expired_units, used_units, newly_added_units, ordered_units...)
Train samples: 717, Test samples: 351
Train split: 627, Validation: 90

Training model...
Training until validation scores don't improve for 50 rounds
Early stopping, best iteration is:
[49]	train's rmse: 5.5319	val's rmse: 14.4606

Evaluating on test set...
Normalized MAE: 0.0931, Stockout Rate: 0.00%, MAPE: 9.4%
Saved model to ml/models_priority3_all/C10/model_h14_l2.txt
Saved feature importance to ml/models_priority3_all/C10/feature_importance_h14_l2.csv
Saved predictions to ml/models_priority3_all/C10/predictions_h14_l2.csv
Saved metrics to ml/models_priority3_all/C10/metrics_h14_l2.json

============================================================
Dataset: C2, Horizon: 14, Objective: l2
============================================================
Train: 731 rows (2023-01-01 00:00:00 to 2024-12-31 00:00:00)
Test: 365 rows (2025-01-01 00:00:00 to 2025-12-31 00:00:00)
Warning: Some feature columns not found: ['trend_slope_7d', 'trend_slope_14d', 'trend_slope_30d', 'momentum_7d', 'momentum_14d', 'momentum_30d', 'trend_up_7d', 'trend_up_14d', 'trend_up_30d', 'trend_strength_7d', 'trend_strength_14d', 'trend_strength_30d']
Features: 19 (total_onsite_units, expired_units, used_units, newly_added_units, ordered_units...)
Train samples: 717, Test samples: 351
Train split: 627, Validation: 90

Training model...
Training until validation scores don't improve for 50 rounds
Early stopping, best iteration is:
[1]	train's rmse: 8.2275	val's rmse: 10.6452

Evaluating on test set...
Normalized MAE: 0.0785, Stockout Rate: 0.00%, MAPE: 7.8%
Saved model to ml/models_priority3_all/C2/model_h14_l2.txt
Saved feature importance to ml/models_priority3_all/C2/feature_importance_h14_l2.csv
Saved predictions to ml/models_priority3_all/C2/predictions_h14_l2.csv
Saved metrics to ml/models_priority3_all/C2/metrics_h14_l2.json

============================================================
Dataset: C3, Horizon: 14, Objective: l2
============================================================
Train: 731 rows (2023-01-01 00:00:00 to 2024-12-31 00:00:00)
Test: 365 rows (2025-01-01 00:00:00 to 2025-12-31 00:00:00)
Warning: Some feature columns not found: ['trend_slope_7d', 'trend_slope_14d', 'trend_slope_30d', 'momentum_7d', 'momentum_14d', 'momentum_30d', 'trend_up_7d', 'trend_up_14d', 'trend_up_30d', 'trend_strength_7d', 'trend_strength_14d', 'trend_strength_30d']
Features: 19 (total_onsite_units, expired_units, used_units, newly_added_units, ordered_units...)
Train samples: 717, Test samples: 351
Train split: 627, Validation: 90

Training model...
Training until validation scores don't improve for 50 rounds
Early stopping, best iteration is:
[4]	train's rmse: 13.1776	val's rmse: 25.1904

Evaluating on test set...
Normalized MAE: 0.0605, Stockout Rate: 0.00%, MAPE: 6.1%
Saved model to ml/models_priority3_all/C3/model_h14_l2.txt
Saved feature importance to ml/models_priority3_all/C3/feature_importance_h14_l2.csv
Saved predictions to ml/models_priority3_all/C3/predictions_h14_l2.csv
Saved metrics to ml/models_priority3_all/C3/metrics_h14_l2.json

============================================================
Dataset: C4, Horizon: 14, Objective: l2
============================================================
Train: 731 rows (2023-01-01 00:00:00 to 2024-12-31 00:00:00)
Test: 365 rows (2025-01-01 00:00:00 to 2025-12-31 00:00:00)
Warning: Some feature columns not found: ['trend_slope_7d', 'trend_slope_14d', 'trend_slope_30d', 'momentum_7d', 'momentum_14d', 'momentum_30d', 'trend_up_7d', 'trend_up_14d', 'trend_up_30d', 'trend_strength_7d', 'trend_strength_14d', 'trend_strength_30d']
Features: 19 (total_onsite_units, expired_units, used_units, newly_added_units, ordered_units...)
Train samples: 717, Test samples: 351
Train split: 627, Validation: 90

Training model...
Training until validation scores don't improve for 50 rounds
Early stopping, best iteration is:
[10]	train's rmse: 14.7669	val's rmse: 14.0986

Evaluating on test set...
Normalized MAE: 0.0671, Stockout Rate: 0.00%, MAPE: 6.8%
Saved model to ml/models_priority3_all/C4/model_h14_l2.txt
Saved feature importance to ml/models_priority3_all/C4/feature_importance_h14_l2.csv
Saved predictions to ml/models_priority3_all/C4/predictions_h14_l2.csv
Saved metrics to ml/models_priority3_all/C4/metrics_h14_l2.json

============================================================
Dataset: C5, Horizon: 14, Objective: l2
============================================================
Train: 731 rows (2023-01-01 00:00:00 to 2024-12-31 00:00:00)
Test: 365 rows (2025-01-01 00:00:00 to 2025-12-31 00:00:00)
Warning: Some feature columns not found: ['trend_slope_7d', 'trend_slope_14d', 'trend_slope_30d', 'momentum_7d', 'momentum_14d', 'momentum_30d', 'trend_up_7d', 'trend_up_14d', 'trend_up_30d', 'trend_strength_7d', 'trend_strength_14d', 'trend_strength_30d']
Features: 19 (total_onsite_units, expired_units, used_units, newly_added_units, ordered_units...)
Train samples: 717, Test samples: 351
Train split: 627, Validation: 90

Training model...
Training until validation scores don't improve for 50 rounds
Early stopping, best iteration is:
[35]	train's rmse: 8.90055	val's rmse: 23.0788

Evaluating on test set...
Normalized MAE: 0.0735, Stockout Rate: 0.00%, MAPE: 7.2%
Saved model to ml/models_priority3_all/C5/model_h14_l2.txt
Saved feature importance to ml/models_priority3_all/C5/feature_importance_h14_l2.csv
Saved predictions to ml/models_priority3_all/C5/predictions_h14_l2.csv
Saved metrics to ml/models_priority3_all/C5/metrics_h14_l2.json

============================================================
Dataset: C6, Horizon: 14, Objective: l2
============================================================
Train: 731 rows (2023-01-01 00:00:00 to 2024-12-31 00:00:00)
Test: 365 rows (2025-01-01 00:00:00 to 2025-12-31 00:00:00)
Warning: Some feature columns not found: ['trend_slope_7d', 'trend_slope_14d', 'trend_slope_30d', 'momentum_7d', 'momentum_14d', 'momentum_30d', 'trend_up_7d', 'trend_up_14d', 'trend_up_30d', 'trend_strength_7d', 'trend_strength_14d', 'trend_strength_30d']
Features: 19 (total_onsite_units, expired_units, used_units, newly_added_units, ordered_units...)
Train samples: 717, Test samples: 351
Train split: 627, Validation: 90

Training model...
Training until validation scores don't improve for 50 rounds
Early stopping, best iteration is:
[3]	train's rmse: 10.3092	val's rmse: 9.47101

Evaluating on test set...
Normalized MAE: 0.0738, Stockout Rate: 0.00%, MAPE: 7.5%
Saved model to ml/models_priority3_all/C6/model_h14_l2.txt
Saved feature importance to ml/models_priority3_all/C6/feature_importance_h14_l2.csv
Saved predictions to ml/models_priority3_all/C6/predictions_h14_l2.csv
Saved metrics to ml/models_priority3_all/C6/metrics_h14_l2.json

============================================================
Dataset: C7, Horizon: 14, Objective: l2
============================================================
Train: 731 rows (2023-01-01 00:00:00 to 2024-12-31 00:00:00)
Test: 365 rows (2025-01-01 00:00:00 to 2025-12-31 00:00:00)
Warning: Some feature columns not found: ['trend_slope_7d', 'trend_slope_14d', 'trend_slope_30d', 'momentum_7d', 'momentum_14d', 'momentum_30d', 'trend_up_7d', 'trend_up_14d', 'trend_up_30d', 'trend_strength_7d', 'trend_strength_14d', 'trend_strength_30d']
Features: 19 (total_onsite_units, expired_units, used_units, newly_added_units, ordered_units...)
Train samples: 717, Test samples: 351
Train split: 627, Validation: 90

Training model...
Training until validation scores don't improve for 50 rounds
Early stopping, best iteration is:
[40]	train's rmse: 7.10556	val's rmse: 12.8646

Evaluating on test set...
Normalized MAE: 0.0776, Stockout Rate: 0.00%, MAPE: 7.8%
Saved model to ml/models_priority3_all/C7/model_h14_l2.txt
Saved feature importance to ml/models_priority3_all/C7/feature_importance_h14_l2.csv
Saved predictions to ml/models_priority3_all/C7/predictions_h14_l2.csv
Saved metrics to ml/models_priority3_all/C7/metrics_h14_l2.json

============================================================
Dataset: C8, Horizon: 14, Objective: l2
============================================================
Train: 731 rows (2023-01-01 00:00:00 to 2024-12-31 00:00:00)
Test: 365 rows (2025-01-01 00:00:00 to 2025-12-31 00:00:00)
Warning: Some feature columns not found: ['trend_slope_7d', 'trend_slope_14d', 'trend_slope_30d', 'momentum_7d', 'momentum_14d', 'momentum_30d', 'trend_up_7d', 'trend_up_14d', 'trend_up_30d', 'trend_strength_7d', 'trend_strength_14d', 'trend_strength_30d']
Features: 19 (total_onsite_units, expired_units, used_units, newly_added_units, ordered_units...)
Train samples: 717, Test samples: 351
Train split: 627, Validation: 90

Training model...
Training until validation scores don't improve for 50 rounds
Early stopping, best iteration is:
[11]	train's rmse: 13.0979	val's rmse: 11.0905

Evaluating on test set...
Normalized MAE: 0.0639, Stockout Rate: 0.00%, MAPE: 6.3%
Saved model to ml/models_priority3_all/C8/model_h14_l2.txt
Saved feature importance to ml/models_priority3_all/C8/feature_importance_h14_l2.csv
Saved predictions to ml/models_priority3_all/C8/predictions_h14_l2.csv
Saved metrics to ml/models_priority3_all/C8/metrics_h14_l2.json

============================================================
Dataset: C9, Horizon: 14, Objective: l2
============================================================
Train: 731 rows (2023-01-01 00:00:00 to 2024-12-31 00:00:00)
Test: 365 rows (2025-01-01 00:00:00 to 2025-12-31 00:00:00)
Warning: Some feature columns not found: ['trend_slope_7d', 'trend_slope_14d', 'trend_slope_30d', 'momentum_7d', 'momentum_14d', 'momentum_30d', 'trend_up_7d', 'trend_up_14d', 'trend_up_30d', 'trend_strength_7d', 'trend_strength_14d', 'trend_strength_30d']
Features: 19 (total_onsite_units, expired_units, used_units, newly_added_units, ordered_units...)
Train samples: 717, Test samples: 351
Train split: 627, Validation: 90

Training model...
Training until validation scores don't improve for 50 rounds
Early stopping, best iteration is:
[24]	train's rmse: 11.1523	val's rmse: 9.54894

Evaluating on test set...
Normalized MAE: 0.0462, Stockout Rate: 0.00%, MAPE: 4.6%
Saved model to ml/models_priority3_all/C9/model_h14_l2.txt
Saved feature importance to ml/models_priority3_all/C9/feature_importance_h14_l2.csv
Saved predictions to ml/models_priority3_all/C9/predictions_h14_l2.csv
Saved metrics to ml/models_priority3_all/C9/metrics_h14_l2.json

============================================================
Dataset: D1, Horizon: 14, Objective: l2
============================================================
Train: 731 rows (2023-01-01 00:00:00 to 2024-12-31 00:00:00)
Test: 365 rows (2025-01-01 00:00:00 to 2025-12-31 00:00:00)
Warning: Some feature columns not found: ['trend_slope_7d', 'trend_slope_14d', 'trend_slope_30d', 'momentum_7d', 'momentum_14d', 'momentum_30d', 'trend_up_7d', 'trend_up_14d', 'trend_up_30d', 'trend_strength_7d', 'trend_strength_14d', 'trend_strength_30d']
Features: 19 (total_onsite_units, expired_units, used_units, newly_added_units, ordered_units...)
Train samples: 717, Test samples: 351
Train split: 627, Validation: 90

Training model...
Training until validation scores don't improve for 50 rounds
[100]	train's rmse: 3.97192	val's rmse: 15.6165
Early stopping, best iteration is:
[80]	train's rmse: 4.4561	val's rmse: 15.4561

Evaluating on test set...
Normalized MAE: 0.0900, Stockout Rate: 0.00%, MAPE: 9.0%
Saved model to ml/models_priority3_all/D1/model_h14_l2.txt
Saved feature importance to ml/models_priority3_all/D1/feature_importance_h14_l2.csv
Saved predictions to ml/models_priority3_all/D1/predictions_h14_l2.csv
Saved metrics to ml/models_priority3_all/D1/metrics_h14_l2.json

============================================================
Dataset: D10, Horizon: 14, Objective: l2
============================================================
Train: 731 rows (2023-01-01 00:00:00 to 2024-12-31 00:00:00)
Test: 365 rows (2025-01-01 00:00:00 to 2025-12-31 00:00:00)
Warning: Some feature columns not found: ['trend_slope_7d', 'trend_slope_14d', 'trend_slope_30d', 'momentum_7d', 'momentum_14d', 'momentum_30d', 'trend_up_7d', 'trend_up_14d', 'trend_up_30d', 'trend_strength_7d', 'trend_strength_14d', 'trend_strength_30d']
Features: 19 (total_onsite_units, expired_units, used_units, newly_added_units, ordered_units...)
Train samples: 717, Test samples: 351
Train split: 627, Validation: 90

Training model...
Training until validation scores don't improve for 50 rounds
[100]	train's rmse: 4.76093	val's rmse: 13.8674
[200]	train's rmse: 2.92754	val's rmse: 13.8669
Early stopping, best iteration is:
[155]	train's rmse: 3.61929	val's rmse: 13.7897

Evaluating on test set...
Normalized MAE: 0.0809, Stockout Rate: 0.00%, MAPE: 8.0%
Saved model to ml/models_priority3_all/D10/model_h14_l2.txt
Saved feature importance to ml/models_priority3_all/D10/feature_importance_h14_l2.csv
Saved predictions to ml/models_priority3_all/D10/predictions_h14_l2.csv
Saved metrics to ml/models_priority3_all/D10/metrics_h14_l2.json

============================================================
Dataset: D2, Horizon: 14, Objective: l2
============================================================
Train: 731 rows (2023-01-01 00:00:00 to 2024-12-31 00:00:00)
Test: 365 rows (2025-01-01 00:00:00 to 2025-12-31 00:00:00)
Warning: Some feature columns not found: ['trend_slope_7d', 'trend_slope_14d', 'trend_slope_30d', 'momentum_7d', 'momentum_14d', 'momentum_30d', 'trend_up_7d', 'trend_up_14d', 'trend_up_30d', 'trend_strength_7d', 'trend_strength_14d', 'trend_strength_30d']
Features: 19 (total_onsite_units, expired_units, used_units, newly_added_units, ordered_units...)
Train samples: 717, Test samples: 351
Train split: 627, Validation: 90

Training model...
Training until validation scores don't improve for 50 rounds
[100]	train's rmse: 4.7181	val's rmse: 14.0003
Early stopping, best iteration is:
[50]	train's rmse: 7.60208	val's rmse: 12.8144

Evaluating on test set...
Normalized MAE: 0.0613, Stockout Rate: 0.00%, MAPE: 6.1%
Saved model to ml/models_priority3_all/D2/model_h14_l2.txt
Saved feature importance to ml/models_priority3_all/D2/feature_importance_h14_l2.csv
Saved predictions to ml/models_priority3_all/D2/predictions_h14_l2.csv
Saved metrics to ml/models_priority3_all/D2/metrics_h14_l2.json

============================================================
Dataset: D3, Horizon: 14, Objective: l2
============================================================
Train: 731 rows (2023-01-01 00:00:00 to 2024-12-31 00:00:00)
Test: 365 rows (2025-01-01 00:00:00 to 2025-12-31 00:00:00)
Warning: Some feature columns not found: ['trend_slope_7d', 'trend_slope_14d', 'trend_slope_30d', 'momentum_7d', 'momentum_14d', 'momentum_30d', 'trend_up_7d', 'trend_up_14d', 'trend_up_30d', 'trend_strength_7d', 'trend_strength_14d', 'trend_strength_30d']
Features: 19 (total_onsite_units, expired_units, used_units, newly_added_units, ordered_units...)
Train samples: 717, Test samples: 351
Train split: 627, Validation: 90

Training model...
Training until validation scores don't improve for 50 rounds
Early stopping, best iteration is:
[1]	train's rmse: 50.4837	val's rmse: 17.5225

Evaluating on test set...
Normalized MAE: 0.2106, Stockout Rate: 0.00%, MAPE: 24.6%
Saved model to ml/models_priority3_all/D3/model_h14_l2.txt
Saved feature importance to ml/models_priority3_all/D3/feature_importance_h14_l2.csv
Saved predictions to ml/models_priority3_all/D3/predictions_h14_l2.csv
Saved metrics to ml/models_priority3_all/D3/metrics_h14_l2.json

============================================================
Dataset: D4, Horizon: 14, Objective: l2
============================================================
Train: 731 rows (2023-01-01 00:00:00 to 2024-12-31 00:00:00)
Test: 365 rows (2025-01-01 00:00:00 to 2025-12-31 00:00:00)
Warning: Some feature columns not found: ['trend_slope_7d', 'trend_slope_14d', 'trend_slope_30d', 'momentum_7d', 'momentum_14d', 'momentum_30d', 'trend_up_7d', 'trend_up_14d', 'trend_up_30d', 'trend_strength_7d', 'trend_strength_14d', 'trend_strength_30d']
Features: 19 (total_onsite_units, expired_units, used_units, newly_added_units, ordered_units...)
Train samples: 717, Test samples: 351
Train split: 627, Validation: 90

Training model...
Training until validation scores don't improve for 50 rounds
[100]	train's rmse: 3.98753	val's rmse: 6.77681
Early stopping, best iteration is:
[55]	train's rmse: 5.36765	val's rmse: 6.69292

Evaluating on test set...
Normalized MAE: 0.0761, Stockout Rate: 0.00%, MAPE: 7.6%
Saved model to ml/models_priority3_all/D4/model_h14_l2.txt
Saved feature importance to ml/models_priority3_all/D4/feature_importance_h14_l2.csv
Saved predictions to ml/models_priority3_all/D4/predictions_h14_l2.csv
Saved metrics to ml/models_priority3_all/D4/metrics_h14_l2.json

============================================================
Dataset: D5, Horizon: 14, Objective: l2
============================================================
Train: 731 rows (2023-01-01 00:00:00 to 2024-12-31 00:00:00)
Test: 365 rows (2025-01-01 00:00:00 to 2025-12-31 00:00:00)
Warning: Some feature columns not found: ['trend_slope_7d', 'trend_slope_14d', 'trend_slope_30d', 'momentum_7d', 'momentum_14d', 'momentum_30d', 'trend_up_7d', 'trend_up_14d', 'trend_up_30d', 'trend_strength_7d', 'trend_strength_14d', 'trend_strength_30d']
Features: 19 (total_onsite_units, expired_units, used_units, newly_added_units, ordered_units...)
Train samples: 717, Test samples: 351
Train split: 627, Validation: 90

Training model...
Training until validation scores don't improve for 50 rounds
[100]	train's rmse: 4.52539	val's rmse: 14.0716
Early stopping, best iteration is:
[130]	train's rmse: 3.90001	val's rmse: 14.0144

Evaluating on test set...
Normalized MAE: 0.0895, Stockout Rate: 0.00%, MAPE: 8.8%
Saved model to ml/models_priority3_all/D5/model_h14_l2.txt
Saved feature importance to ml/models_priority3_all/D5/feature_importance_h14_l2.csv
Saved predictions to ml/models_priority3_all/D5/predictions_h14_l2.csv
Saved metrics to ml/models_priority3_all/D5/metrics_h14_l2.json

============================================================
Dataset: D6, Horizon: 14, Objective: l2
============================================================
Train: 731 rows (2023-01-01 00:00:00 to 2024-12-31 00:00:00)
Test: 365 rows (2025-01-01 00:00:00 to 2025-12-31 00:00:00)
Warning: Some feature columns not found: ['trend_slope_7d', 'trend_slope_14d', 'trend_slope_30d', 'momentum_7d', 'momentum_14d', 'momentum_30d', 'trend_up_7d', 'trend_up_14d', 'trend_up_30d', 'trend_strength_7d', 'trend_strength_14d', 'trend_strength_30d']
Features: 19 (total_onsite_units, expired_units, used_units, newly_added_units, ordered_units...)
Train samples: 717, Test samples: 351
Train split: 627, Validation: 90

Training model...
Training until validation scores don't improve for 50 rounds
Early stopping, best iteration is:
[16]	train's rmse: 25.3771	val's rmse: 15.5733

Evaluating on test set...
Normalized MAE: 0.1018, Stockout Rate: 0.00%, MAPE: 11.5%
Saved model to ml/models_priority3_all/D6/model_h14_l2.txt
Saved feature importance to ml/models_priority3_all/D6/feature_importance_h14_l2.csv
Saved predictions to ml/models_priority3_all/D6/predictions_h14_l2.csv
Saved metrics to ml/models_priority3_all/D6/metrics_h14_l2.json

============================================================
Dataset: D7, Horizon: 14, Objective: l2
============================================================
Train: 731 rows (2023-01-01 00:00:00 to 2024-12-31 00:00:00)
Test: 365 rows (2025-01-01 00:00:00 to 2025-12-31 00:00:00)
Warning: Some feature columns not found: ['trend_slope_7d', 'trend_slope_14d', 'trend_slope_30d', 'momentum_7d', 'momentum_14d', 'momentum_30d', 'trend_up_7d', 'trend_up_14d', 'trend_up_30d', 'trend_strength_7d', 'trend_strength_14d', 'trend_strength_30d']
Features: 19 (total_onsite_units, expired_units, used_units, newly_added_units, ordered_units...)
Train samples: 717, Test samples: 351
Train split: 627, Validation: 90

Training model...
Training until validation scores don't improve for 50 rounds
Early stopping, best iteration is:
[38]	train's rmse: 7.90368	val's rmse: 14.1382

Evaluating on test set...
Normalized MAE: 0.0883, Stockout Rate: 0.00%, MAPE: 9.2%
Saved model to ml/models_priority3_all/D7/model_h14_l2.txt
Saved feature importance to ml/models_priority3_all/D7/feature_importance_h14_l2.csv
Saved predictions to ml/models_priority3_all/D7/predictions_h14_l2.csv
Saved metrics to ml/models_priority3_all/D7/metrics_h14_l2.json

============================================================
Dataset: D8, Horizon: 14, Objective: l2
============================================================
Train: 731 rows (2023-01-01 00:00:00 to 2024-12-31 00:00:00)
Test: 365 rows (2025-01-01 00:00:00 to 2025-12-31 00:00:00)
Warning: Some feature columns not found: ['trend_slope_7d', 'trend_slope_14d', 'trend_slope_30d', 'momentum_7d', 'momentum_14d', 'momentum_30d', 'trend_up_7d', 'trend_up_14d', 'trend_up_30d', 'trend_strength_7d', 'trend_strength_14d', 'trend_strength_30d']
Features: 19 (total_onsite_units, expired_units, used_units, newly_added_units, ordered_units...)
Train samples: 717, Test samples: 351
Train split: 627, Validation: 90

Training model...
Training until validation scores don't improve for 50 rounds
[100]	train's rmse: 4.8799	val's rmse: 11.8336
[200]	train's rmse: 3.13877	val's rmse: 11.3317
Early stopping, best iteration is:
[163]	train's rmse: 3.66605	val's rmse: 11.2314

Evaluating on test set...
Normalized MAE: 0.0935, Stockout Rate: 0.00%, MAPE: 9.6%
Saved model to ml/models_priority3_all/D8/model_h14_l2.txt
Saved feature importance to ml/models_priority3_all/D8/feature_importance_h14_l2.csv
Saved predictions to ml/models_priority3_all/D8/predictions_h14_l2.csv
Saved metrics to ml/models_priority3_all/D8/metrics_h14_l2.json

============================================================
Dataset: D9, Horizon: 14, Objective: l2
============================================================
Train: 731 rows (2023-01-01 00:00:00 to 2024-12-31 00:00:00)
Test: 365 rows (2025-01-01 00:00:00 to 2025-12-31 00:00:00)
Warning: Some feature columns not found: ['trend_slope_7d', 'trend_slope_14d', 'trend_slope_30d', 'momentum_7d', 'momentum_14d', 'momentum_30d', 'trend_up_7d', 'trend_up_14d', 'trend_up_30d', 'trend_strength_7d', 'trend_strength_14d', 'trend_strength_30d']
Features: 19 (total_onsite_units, expired_units, used_units, newly_added_units, ordered_units...)
Train samples: 717, Test samples: 351
Train split: 627, Validation: 90

Training model...
Training until validation scores don't improve for 50 rounds
[100]	train's rmse: 7.16772	val's rmse: 14.711
Early stopping, best iteration is:
[72]	train's rmse: 8.63956	val's rmse: 14.5395

Evaluating on test set...
Normalized MAE: 0.0538, Stockout Rate: 0.00%, MAPE: 5.6%
Saved model to ml/models_priority3_all/D9/model_h14_l2.txt
Saved feature importance to ml/models_priority3_all/D9/feature_importance_h14_l2.csv
Saved predictions to ml/models_priority3_all/D9/predictions_h14_l2.csv
Saved metrics to ml/models_priority3_all/D9/metrics_h14_l2.json

============================================================
Dataset: E1, Horizon: 14, Objective: l2
============================================================
Train: 731 rows (2023-01-01 00:00:00 to 2024-12-31 00:00:00)
Test: 365 rows (2025-01-01 00:00:00 to 2025-12-31 00:00:00)
Warning: Some feature columns not found: ['trend_slope_7d', 'trend_slope_14d', 'trend_slope_30d', 'momentum_7d', 'momentum_14d', 'momentum_30d', 'trend_up_7d', 'trend_up_14d', 'trend_up_30d', 'trend_strength_7d', 'trend_strength_14d', 'trend_strength_30d']
Features: 19 (total_onsite_units, expired_units, used_units, newly_added_units, ordered_units...)
Train samples: 717, Test samples: 351
Train split: 627, Validation: 90

Training model...
Training until validation scores don't improve for 50 rounds
Early stopping, best iteration is:
[25]	train's rmse: 13.9782	val's rmse: 12.9974

Evaluating on test set...
Normalized MAE: 0.0756, Stockout Rate: 0.00%, MAPE: 7.6%
Saved model to ml/models_priority3_all/E1/model_h14_l2.txt
Saved feature importance to ml/models_priority3_all/E1/feature_importance_h14_l2.csv
Saved predictions to ml/models_priority3_all/E1/predictions_h14_l2.csv
Saved metrics to ml/models_priority3_all/E1/metrics_h14_l2.json

============================================================
Dataset: E10, Horizon: 14, Objective: l2
============================================================
Train: 731 rows (2023-01-01 00:00:00 to 2024-12-31 00:00:00)
Test: 365 rows (2025-01-01 00:00:00 to 2025-12-31 00:00:00)
Warning: Some feature columns not found: ['trend_slope_7d', 'trend_slope_14d', 'trend_slope_30d', 'momentum_7d', 'momentum_14d', 'momentum_30d', 'trend_up_7d', 'trend_up_14d', 'trend_up_30d', 'trend_strength_7d', 'trend_strength_14d', 'trend_strength_30d']
Features: 19 (total_onsite_units, expired_units, used_units, newly_added_units, ordered_units...)
Train samples: 717, Test samples: 351
Train split: 627, Validation: 90

Training model...
Training until validation scores don't improve for 50 rounds
Early stopping, best iteration is:
[1]	train's rmse: 30.8744	val's rmse: 15.2575

Evaluating on test set...
Normalized MAE: 0.1564, Stockout Rate: 0.00%, MAPE: 17.5%
Saved model to ml/models_priority3_all/E10/model_h14_l2.txt
Saved feature importance to ml/models_priority3_all/E10/feature_importance_h14_l2.csv
Saved predictions to ml/models_priority3_all/E10/predictions_h14_l2.csv
Saved metrics to ml/models_priority3_all/E10/metrics_h14_l2.json

============================================================
Dataset: E2, Horizon: 14, Objective: l2
============================================================
Train: 731 rows (2023-01-01 00:00:00 to 2024-12-31 00:00:00)
Test: 365 rows (2025-01-01 00:00:00 to 2025-12-31 00:00:00)
Warning: Some feature columns not found: ['trend_slope_7d', 'trend_slope_14d', 'trend_slope_30d', 'momentum_7d', 'momentum_14d', 'momentum_30d', 'trend_up_7d', 'trend_up_14d', 'trend_up_30d', 'trend_strength_7d', 'trend_strength_14d', 'trend_strength_30d']
Features: 19 (total_onsite_units, expired_units, used_units, newly_added_units, ordered_units...)
Train samples: 717, Test samples: 351
Train split: 627, Validation: 90

Training model...
Training until validation scores don't improve for 50 rounds
[100]	train's rmse: 3.85949	val's rmse: 10.664
Early stopping, best iteration is:
[50]	train's rmse: 5.32859	val's rmse: 10.1477

Evaluating on test set...
Normalized MAE: 0.1029, Stockout Rate: 0.00%, MAPE: 10.7%
Saved model to ml/models_priority3_all/E2/model_h14_l2.txt
Saved feature importance to ml/models_priority3_all/E2/feature_importance_h14_l2.csv
Saved predictions to ml/models_priority3_all/E2/predictions_h14_l2.csv
Saved metrics to ml/models_priority3_all/E2/metrics_h14_l2.json

============================================================
Dataset: E3, Horizon: 14, Objective: l2
============================================================
Train: 731 rows (2023-01-01 00:00:00 to 2024-12-31 00:00:00)
Test: 365 rows (2025-01-01 00:00:00 to 2025-12-31 00:00:00)
Warning: Some feature columns not found: ['trend_slope_7d', 'trend_slope_14d', 'trend_slope_30d', 'momentum_7d', 'momentum_14d', 'momentum_30d', 'trend_up_7d', 'trend_up_14d', 'trend_up_30d', 'trend_strength_7d', 'trend_strength_14d', 'trend_strength_30d']
Features: 19 (total_onsite_units, expired_units, used_units, newly_added_units, ordered_units...)
Train samples: 717, Test samples: 351
Train split: 627, Validation: 90

Training model...
Training until validation scores don't improve for 50 rounds
Early stopping, best iteration is:
[46]	train's rmse: 12.4441	val's rmse: 39.3439

Evaluating on test set...
Normalized MAE: 0.1368, Stockout Rate: 0.28%, MAPE: 12.5%
Saved model to ml/models_priority3_all/E3/model_h14_l2.txt
Saved feature importance to ml/models_priority3_all/E3/feature_importance_h14_l2.csv
Saved predictions to ml/models_priority3_all/E3/predictions_h14_l2.csv
Saved metrics to ml/models_priority3_all/E3/metrics_h14_l2.json

============================================================
Dataset: E4, Horizon: 14, Objective: l2
============================================================
Train: 731 rows (2023-01-01 00:00:00 to 2024-12-31 00:00:00)
Test: 365 rows (2025-01-01 00:00:00 to 2025-12-31 00:00:00)
Warning: Some feature columns not found: ['trend_slope_7d', 'trend_slope_14d', 'trend_slope_30d', 'momentum_7d', 'momentum_14d', 'momentum_30d', 'trend_up_7d', 'trend_up_14d', 'trend_up_30d', 'trend_strength_7d', 'trend_strength_14d', 'trend_strength_30d']
Features: 19 (total_onsite_units, expired_units, used_units, newly_added_units, ordered_units...)
Train samples: 717, Test samples: 351
Train split: 627, Validation: 90

Training model...
Training until validation scores don't improve for 50 rounds
[100]	train's rmse: 7.16664	val's rmse: 11.0088
Early stopping, best iteration is:
[79]	train's rmse: 8.2287	val's rmse: 10.9413

Evaluating on test set...
Normalized MAE: 0.1012, Stockout Rate: 0.00%, MAPE: 10.5%
Saved model to ml/models_priority3_all/E4/model_h14_l2.txt
Saved feature importance to ml/models_priority3_all/E4/feature_importance_h14_l2.csv
Saved predictions to ml/models_priority3_all/E4/predictions_h14_l2.csv
Saved metrics to ml/models_priority3_all/E4/metrics_h14_l2.json

============================================================
Dataset: E5, Horizon: 14, Objective: l2
============================================================
Train: 731 rows (2023-01-01 00:00:00 to 2024-12-31 00:00:00)
Test: 365 rows (2025-01-01 00:00:00 to 2025-12-31 00:00:00)
Warning: Some feature columns not found: ['trend_slope_7d', 'trend_slope_14d', 'trend_slope_30d', 'momentum_7d', 'momentum_14d', 'momentum_30d', 'trend_up_7d', 'trend_up_14d', 'trend_up_30d', 'trend_strength_7d', 'trend_strength_14d', 'trend_strength_30d']
Features: 19 (total_onsite_units, expired_units, used_units, newly_added_units, ordered_units...)
Train samples: 717, Test samples: 351
Train split: 627, Validation: 90

Training model...
Training until validation scores don't improve for 50 rounds
[100]	train's rmse: 9.54219	val's rmse: 11.4713
Early stopping, best iteration is:
[75]	train's rmse: 10.4553	val's rmse: 11.2825

Evaluating on test set...
Normalized MAE: 0.1410, Stockout Rate: 0.00%, MAPE: 14.9%
Saved model to ml/models_priority3_all/E5/model_h14_l2.txt
Saved feature importance to ml/models_priority3_all/E5/feature_importance_h14_l2.csv
Saved predictions to ml/models_priority3_all/E5/predictions_h14_l2.csv
Saved metrics to ml/models_priority3_all/E5/metrics_h14_l2.json

============================================================
Dataset: E6, Horizon: 14, Objective: l2
============================================================
Train: 731 rows (2023-01-01 00:00:00 to 2024-12-31 00:00:00)
Test: 365 rows (2025-01-01 00:00:00 to 2025-12-31 00:00:00)
Warning: Some feature columns not found: ['trend_slope_7d', 'trend_slope_14d', 'trend_slope_30d', 'momentum_7d', 'momentum_14d', 'momentum_30d', 'trend_up_7d', 'trend_up_14d', 'trend_up_30d', 'trend_strength_7d', 'trend_strength_14d', 'trend_strength_30d']
Features: 19 (total_onsite_units, expired_units, used_units, newly_added_units, ordered_units...)
Train samples: 717, Test samples: 351
Train split: 627, Validation: 90

Training model...
Training until validation scores don't improve for 50 rounds
Early stopping, best iteration is:
[34]	train's rmse: 8.9327	val's rmse: 9.22521

Evaluating on test set...
Normalized MAE: 0.1048, Stockout Rate: 0.00%, MAPE: 10.1%
Saved model to ml/models_priority3_all/E6/model_h14_l2.txt
Saved feature importance to ml/models_priority3_all/E6/feature_importance_h14_l2.csv
Saved predictions to ml/models_priority3_all/E6/predictions_h14_l2.csv
Saved metrics to ml/models_priority3_all/E6/metrics_h14_l2.json

============================================================
Dataset: E7, Horizon: 14, Objective: l2
============================================================
Train: 731 rows (2023-01-01 00:00:00 to 2024-12-31 00:00:00)
Test: 365 rows (2025-01-01 00:00:00 to 2025-12-31 00:00:00)
Warning: Some feature columns not found: ['trend_slope_7d', 'trend_slope_14d', 'trend_slope_30d', 'momentum_7d', 'momentum_14d', 'momentum_30d', 'trend_up_7d', 'trend_up_14d', 'trend_up_30d', 'trend_strength_7d', 'trend_strength_14d', 'trend_strength_30d']
Features: 19 (total_onsite_units, expired_units, used_units, newly_added_units, ordered_units...)
Train samples: 717, Test samples: 351
Train split: 627, Validation: 90

Training model...
Training until validation scores don't improve for 50 rounds
Early stopping, best iteration is:
[18]	train's rmse: 22.6532	val's rmse: 26.9738

Evaluating on test set...
Normalized MAE: 0.0729, Stockout Rate: 0.00%, MAPE: 7.5%
Saved model to ml/models_priority3_all/E7/model_h14_l2.txt
Saved feature importance to ml/models_priority3_all/E7/feature_importance_h14_l2.csv
Saved predictions to ml/models_priority3_all/E7/predictions_h14_l2.csv
Saved metrics to ml/models_priority3_all/E7/metrics_h14_l2.json

============================================================
Dataset: E8, Horizon: 14, Objective: l2
============================================================
Train: 731 rows (2023-01-01 00:00:00 to 2024-12-31 00:00:00)
Test: 365 rows (2025-01-01 00:00:00 to 2025-12-31 00:00:00)
Warning: Some feature columns not found: ['trend_slope_7d', 'trend_slope_14d', 'trend_slope_30d', 'momentum_7d', 'momentum_14d', 'momentum_30d', 'trend_up_7d', 'trend_up_14d', 'trend_up_30d', 'trend_strength_7d', 'trend_strength_14d', 'trend_strength_30d']
Features: 19 (total_onsite_units, expired_units, used_units, newly_added_units, ordered_units...)
Train samples: 717, Test samples: 351
Train split: 627, Validation: 90

Training model...
Training until validation scores don't improve for 50 rounds
Early stopping, best iteration is:
[45]	train's rmse: 15.1137	val's rmse: 12.4448

Evaluating on test set...
Normalized MAE: 0.1579, Stockout Rate: 0.00%, MAPE: 16.4%
Saved model to ml/models_priority3_all/E8/model_h14_l2.txt
Saved feature importance to ml/models_priority3_all/E8/feature_importance_h14_l2.csv
Saved predictions to ml/models_priority3_all/E8/predictions_h14_l2.csv
Saved metrics to ml/models_priority3_all/E8/metrics_h14_l2.json

============================================================
Dataset: E9, Horizon: 14, Objective: l2
============================================================
Train: 731 rows (2023-01-01 00:00:00 to 2024-12-31 00:00:00)
Test: 365 rows (2025-01-01 00:00:00 to 2025-12-31 00:00:00)
Warning: Some feature columns not found: ['trend_slope_7d', 'trend_slope_14d', 'trend_slope_30d', 'momentum_7d', 'momentum_14d', 'momentum_30d', 'trend_up_7d', 'trend_up_14d', 'trend_up_30d', 'trend_strength_7d', 'trend_strength_14d', 'trend_strength_30d']
Features: 19 (total_onsite_units, expired_units, used_units, newly_added_units, ordered_units...)
Train samples: 717, Test samples: 351
Train split: 627, Validation: 90

Training model...
Training until validation scores don't improve for 50 rounds
Early stopping, best iteration is:
[41]	train's rmse: 10.5924	val's rmse: 11.1545

Evaluating on test set...
Normalized MAE: 0.0950, Stockout Rate: 0.00%, MAPE: 9.7%
Saved model to ml/models_priority3_all/E9/model_h14_l2.txt
Saved feature importance to ml/models_priority3_all/E9/feature_importance_h14_l2.csv
Saved predictions to ml/models_priority3_all/E9/predictions_h14_l2.csv
Saved metrics to ml/models_priority3_all/E9/metrics_h14_l2.json

================================================================================
SUMMARY
================================================================================
Dataset    Horizon  Norm MAE     Stockout %   MAPE      
--------------------------------------------------------------------------------
A1         14       0.0313       0.00%        3.1%      
A10        14       0.0259       0.00%        2.6%      
A2         14       0.0254       0.28%        2.5%      
A3         14       0.0348       0.00%        3.4%      
A4         14       0.0366       0.00%        3.7%      
A5         14       0.0334       0.00%        3.4%      
A6         14       0.0393       0.00%        3.9%      
A7         14       0.0313       0.00%        3.1%      
A8         14       0.0495       0.00%        5.0%      
A9         14       0.0359       0.00%        3.6%      
B1         14       0.4519       0.00%        80.4%     
B10        14       0.4123       0.00%        62.8%     
B2         14       0.7911       0.00%        62.8%     
B3         14       0.7531       0.00%        115.0%    
B4         14       0.4876       0.28%        48.1%     
B5         14       0.6998       0.00%        74.6%     
B6         14       1.1915       0.00%        90.1%     
B7         14       1.1808       0.00%        94.5%     
B8         14       0.8160       0.00%        121.9%    
B9         14       0.8125       0.00%        96.0%     
C1         14       0.0570       0.00%        5.8%      
C10        14       0.0931       0.00%        9.4%      
C2         14       0.0785       0.00%        7.8%      
C3         14       0.0605       0.00%        6.1%      
C4         14       0.0671       0.00%        6.8%      
C5         14       0.0735       0.00%        7.2%      
C6         14       0.0738       0.00%        7.5%      
C7         14       0.0776       0.00%        7.8%      
C8         14       0.0639       0.00%        6.3%      
C9         14       0.0462       0.00%        4.6%      
D1         14       0.0900       0.00%        9.0%      
D10        14       0.0809       0.00%        8.0%      
D2         14       0.0613       0.00%        6.1%      
D3         14       0.2106       0.00%        24.6%     
D4         14       0.0761       0.00%        7.6%      
D5         14       0.0895       0.00%        8.8%      
D6         14       0.1018       0.00%        11.5%     
D7         14       0.0883       0.00%        9.2%      
D8         14       0.0935       0.00%        9.6%      
D9         14       0.0538       0.00%        5.6%      
E1         14       0.0756       0.00%        7.6%      
E10        14       0.1564       0.00%        17.5%     
E2         14       0.1029       0.00%        10.7%     
E3         14       0.1368       0.28%        12.5%     
E4         14       0.1012       0.00%        10.5%     
E5         14       0.1410       0.00%        14.9%     
E6         14       0.1048       0.00%        10.1%     
E7         14       0.0729       0.00%        7.5%      
E8         14       0.1579       0.00%        16.4%     
E9         14       0.0950       0.00%        9.7%      
================================================================================
Results saved to: ml/models_priority3_all
